show_id,type,title,director,cast,country,date_added,release_year,rating,duration,listed_in,description,combined_text,cluster
s6297,Movie,Bhagam Bhag,Priyadarshan,"Akshay Kumar, Govinda, Lara Dutta, Paresh Rawal, Rajpal Yadav, Jackie Shroff, Arbaaz Khan, Tanushree Dutta, Asrani, Shakti Kapoor",India,"December 31, 2019",2006,TV-14,151 min,"Comedies, International Movies, Romantic Movies","A theater group lands in trouble when its new actress takes her own life, two of its members are framed for murder and no one is who they appear to be.","A theater group lands in trouble when its new actress takes her own life, two of its members are framed for murder and no one is who they appear to be. Comedies, International Movies, Romantic Movies",0
s6539,TV Show,Court Justice,,Chris Bourke,Australia,"October 2, 2019",2017,TV-MA,1 Season,"Crime TV Shows, Docuseries, International TV Shows","In a bustling local court in Sydney, 12 magistrates preside over different levels of criminal offenses and deliver life-changing verdicts.","In a bustling local court in Sydney, 12 magistrates preside over different levels of criminal offenses and deliver life-changing verdicts. Crime TV Shows, Docuseries, International TV Shows",3
s5730,TV Show,Love Around,,"George Hu, Annie Chen, Mandy Tao, Jack Lee, Tan Ai-Chen, Jian Chang, Wang Chuan",Taiwan,"November 1, 2016",2013,TV-14,1 Season,"International TV Shows, Romantic TV Shows, TV Comedies","After a chance meeting at a ballpark, the kind son of a former gangster tries to help an outgoing radio DJ get over her recent heartbreak.","After a chance meeting at a ballpark, the kind son of a former gangster tries to help an outgoing radio DJ get over her recent heartbreak. International TV Shows, Romantic TV Shows, TV Comedies",3
s5063,Movie,Sebastián Marcelo Wainraich,"Raúl Campos, Jan Suter",Sebastián Marcelo Wainraich,Argentina,"January 26, 2018",2018,TV-MA,49 min,Stand-Up Comedy,"Argentine comedian Sebastián Wainraich highlights the comedy in everyday life, from minibars to reasons why funerals are better than weddings.","Argentine comedian Sebastián Wainraich highlights the comedy in everyday life, from minibars to reasons why funerals are better than weddings. Stand-Up Comedy",2
s4079,Movie,The Mistress,Olivia M. Lamasan,"John Lloyd Cruz, Bea Alonzo, Hilda Koronel, Ronaldo Valdez, Anita Linda, Carmi Martin",Philippines,"February 27, 2019",2012,TV-MA,132 min,"Dramas, International Movies, Romantic Movies",The mistress of a wealthy businessman is torn between her loyalty to him and her love for a young architect connected to her in unexpected ways.,"The mistress of a wealthy businessman is torn between her loyalty to him and her love for a young architect connected to her in unexpected ways. Dramas, International Movies, Romantic Movies",0
s246,TV Show,Korean Cold Noodle Rhapsody,,Paik Jong-won,,"August 20, 2021",2021,TV-PG,1 Season,"Docuseries, International TV Shows","Refreshing and flavorful, naengmyeon is Korea's coolest summertime staple. A journey through its history begins, from how it's cooked to how it's loved.","Refreshing and flavorful, naengmyeon is Korea's coolest summertime staple. A journey through its history begins, from how it's cooked to how it's loved. Docuseries, International TV Shows",1
s4344,Movie,Look for a Star,Andrew Lau Wai-Keung,"Andy Lau, Qi Shu, Zhang Hanyu, Denise Ho, Dominic Lam, Xinyi Zhang, David Chiang, George Lam, Rebecca Pan, Maria Cordero, Tat-Ming Cheung",Hong Kong,"December 1, 2018",2009,TV-14,117 min,"Comedies, International Movies, Romantic Movies","While keeping his identity secret, a real estate billionaire tries to woo an outspoken croupier who talks gamblers out of losing their money.","While keeping his identity secret, a real estate billionaire tries to woo an outspoken croupier who talks gamblers out of losing their money. Comedies, International Movies, Romantic Movies",0
s1666,Movie,40 Sticks,Victor Gatonye,"Robert Agengo, Mwaura Bilal, Andreo Kamau, Cajetan Boy, Arabron Nyyeneque, Shiviske Shivisi, Xavier Ywaya",Kenya,"November 20, 2020",2019,TV-14,93 min,"International Movies, Thrillers","When their prison bus crashes in a forest on a rainy night, a group of criminals finds themselves battling wild animals and a mysterious killer.","When their prison bus crashes in a forest on a rainy night, a group of criminals finds themselves battling wild animals and a mysterious killer. International Movies, Thrillers",0
s1091,Movie,Story of Kale: When Someone's in Love,Angga Dwimas Sasongko,"Ardhito Pramono, Aurélie Moeremans, Arya Saloka, Roy Sungkono, Gilbert Pohan, Azizah Hanum, Tanta Ginting",Indonesia,"April 8, 2021",2020,TV-PG,78 min,"Dramas, International Movies, Romantic Movies","After leaving a toxic relationship, Dinda embarks on a romance with Kale, whose view on love soon shatters as he wrestles with his own insecurities.","After leaving a toxic relationship, Dinda embarks on a romance with Kale, whose view on love soon shatters as he wrestles with his own insecurities. Dramas, International Movies, Romantic Movies",0
s3708,TV Show,Motown Magic,,,"Australia, United States","June 28, 2019",2019,TV-Y,2 Seasons,"Kids' TV, TV Sci-Fi & Fantasy","Imaginative boy Ben transforms his city by bringing colorful street art to life, armed with a magic paintbrush – and the classic sounds of Motown.","Imaginative boy Ben transforms his city by bringing colorful street art to life, armed with a magic paintbrush – and the classic sounds of Motown. Kids' TV, TV Sci-Fi & Fantasy",4
s762,TV Show,Human: The World Within,,,,"June 4, 2021",2021,TV-PG,1 Season,"Docuseries, Science & Nature TV",Cutting-edge science and captivating personal stories collide in this illuminating docuseries about the incredible workings of the human body.,"Cutting-edge science and captivating personal stories collide in this illuminating docuseries about the incredible workings of the human body. Docuseries, Science & Nature TV",1
s7809,TV Show,Qué pena tu serie,,"Ariel Levy, Andrea Velasco, Lucy Cominetti, Ignacia Allamand, Paz Bascuñán, Claudia Celedón, Nicolás Martínez",United States,"November 4, 2016",2015,TV-MA,1 Season,"International TV Shows, Romantic TV Shows, Spanish-Language TV Shows","Javier is happily in love with Sofia, so when she breaks up their perfect life, he has to get her back – or maybe try finding a new perfect love.","Javier is happily in love with Sofia, so when she breaks up their perfect life, he has to get her back – or maybe try finding a new perfect love. International TV Shows, Romantic TV Shows, Spanish-Language TV Shows",3
s1196,Movie,Operation Varsity Blues: The College Admissions Scandal,Chris Smith,Matthew Modine,United States,"March 17, 2021",2021,R,100 min,Documentaries,Reenactments drive this documentary investigating the mastermind behind a scam to get the kids of rich and famous families into top US universities.,Reenactments drive this documentary investigating the mastermind behind a scam to get the kids of rich and famous families into top US universities. Documentaries,0
s568,Movie,Congo,Frank Marshall,"Dylan Walsh, Laura Linney, Ernie Hudson, Tim Curry, Joe Don Baker, Grant Heslov, Adewale Akinnuoye-Agbaje, Mary Ellen Trainor",United States,"July 1, 2021",1995,PG-13,108 min,"Action & Adventure, Thrillers","Eight people, some with ulterior motives, go on an expedition to the Congo, where they find a lost city protected by killer apes.","Eight people, some with ulterior motives, go on an expedition to the Congo, where they find a lost city protected by killer apes. Action & Adventure, Thrillers",0
s2058,Movie,Sky Tour: The Movie,Nguyen Thanh Tung,Son Tung M-TP,Vietnam,"September 2, 2020",2020,TV-G,93 min,"Documentaries, International Movies, Music & Musicals","From the preparations to the performances, this documentary showcases Vietnamese pop idol Sơn Tùng M-TP and the passion behind his Sky Tour concerts.","From the preparations to the performances, this documentary showcases Vietnamese pop idol Sơn Tùng M-TP and the passion behind his Sky Tour concerts. Documentaries, International Movies, Music & Musicals",0
s6419,Movie,Cappuccino,Noushad,"Dharmajan Bolgatty, Aneesh Menon, Sunil Sukhada, Anita Lukmance, Kottayam Pradeep, Natasha Doshi, Hareesh Perumanna, Sharanya, Vineeth Mohan, Sudhi Koppa",India,"July 1, 2018",2017,TV-PG,126 min,"Comedies, Dramas, International Movies","Richi is a director of commercials whose computer memory drive is accidentally switched with that of Sneha, a woman he soon falls in love with.","Richi is a director of commercials whose computer memory drive is accidentally switched with that of Sneha, a woman he soon falls in love with. Comedies, Dramas, International Movies",0
s1407,Movie,Penguins of Madagascar: The Movie,"Eric Darnell, Simon J. Smith","Tom McGrath, Christopher Knights, Chris Miller, Conrad Vernon, John Malkovich, Benedict Cumberbatch, Ken Jeong, Annet Mahendru, Peter Stormare",United States,"January 15, 2021",2014,PG,92 min,"Children & Family Movies, Comedies","Elite penguin spies Skipper, Kowalski, Rico and Private join forces with the suave agents of the North Wind to defeat power-mad genius Octavius Brine.","Elite penguin spies Skipper, Kowalski, Rico and Private join forces with the suave agents of the North Wind to defeat power-mad genius Octavius Brine. Children & Family Movies, Comedies",0
s3528,TV Show,"The Mind, Explained",,Emma Stone,United States,"September 12, 2019",2019,TV-14,1 Season,"Docuseries, Science & Nature TV","Ever wonder what's happening inside your head? From dreaming to anxiety disorders, discover how your brain works with this illuminating series.","Ever wonder what's happening inside your head? From dreaming to anxiety disorders, discover how your brain works with this illuminating series. Docuseries, Science & Nature TV",1
s430,Movie,Sanitation Day,Seyi Babatope,"Blossom Chukwujekwu, Elozonam Ogbolu, Nse Ikpe-Etim, Belinda Effah, Saeed Mohammed, Chukwuemeka Okoroafor, Kunle Fawole, Chris Okagbue, Adebayo Salami, Charles Inojie, Elvina Ibru, Tobi Bakare",Nigeria,"July 21, 2021",2020,TV-14,105 min,"Dramas, International Movies, Thrillers",Two cops must contend with the uncooperative tenants of an apartment complex as they try to solve a murder before the crime scene is wiped clean.,"Two cops must contend with the uncooperative tenants of an apartment complex as they try to solve a murder before the crime scene is wiped clean. Dramas, International Movies, Thrillers",0
s8545,TV Show,The Underwear,,"Thanabordee Jaiyen, Emika Grant Emma, Tantimedh Chisanusha, Siribanchawan Jidapa, Supanut Sudjinda",,"June 19, 2018",2017,TV-MA,1 Season,"International TV Shows, TV Dramas, Teen TV Shows",Virtual and real worlds collide as a group of teenagers who are grappling with matters of the heart cross paths in a cafe and on an anonymous website.,"Virtual and real worlds collide as a group of teenagers who are grappling with matters of the heart cross paths in a cafe and on an anonymous website. International TV Shows, TV Dramas, Teen TV Shows",3
s3019,Movie,Legend,Brian Helgeland,"Tom Hardy, Emily Browning, David Thewlis, Duffy, Christopher Eccleston, Chazz Palminteri, Paul Bettany, Taron Egerton, Colin Morgan, Tara Fitzgerald","United Kingdom, France, United States","January 16, 2020",2015,R,132 min,"Dramas, International Movies, Thrillers",Identical twins and notorious gangsters Reggie and Ronnie Kray elude the authorities in 1960s London while transfixing and terrifying the public.,"Identical twins and notorious gangsters Reggie and Ronnie Kray elude the authorities in 1960s London while transfixing and terrifying the public. Dramas, International Movies, Thrillers",0
s7670,Movie,Open Season,"Roger Allers, Jill Culton","Martin Lawrence, Ashton Kutcher, Gary Sinise, Debra Messing, Billy Connolly, Georgia Engel, Jon Favreau, Jane Krakowski, Gordon Tootoosis, Patrick Warburton",United States,"September 1, 2019",2006,PG,86 min,"Children & Family Movies, Comedies","After saving a deer from a hunter's clutches, a domesticated grizzly finds himself relocated to the wild – and unprepared for the real world.","After saving a deer from a hunter's clutches, a domesticated grizzly finds himself relocated to the wild – and unprepared for the real world. Children & Family Movies, Comedies",0
s1544,TV Show,Black Ink Crew New York,,"Ceaser Emanuel, Dutchess Lattimore, Puma Robinson, Alex Estevez, Sassy Bermudez",United States,"December 15, 2020",2014,TV-14,2 Seasons,Reality TV,"At a Black-owned-and-operated hotspot for ink in Harlem, tattoo king Ceaser looks to expand his empire while working with a rambunctious crew.","At a Black-owned-and-operated hotspot for ink in Harlem, tattoo king Ceaser looks to expand his empire while working with a rambunctious crew. Reality TV",1
s5221,Movie,Singapore,Shakti Samanta,"Shammi Kapoor, Padmini, Maria Menado, Shashikala, Agha, K.N. Singh, Madan Puri, Helen","India, Malaysia","October 15, 2017",1960,TV-PG,158 min,"Comedies, Dramas, International Movies","When his employee disappears in Singapore, Shyam travels from India to investigate the absence and becomes entangled in a deadly plot.","When his employee disappears in Singapore, Shyam travels from India to investigate the absence and becomes entangled in a deadly plot. Comedies, Dramas, International Movies",0
s6871,Movie,Golmaal: Fun Unlimited,Rohit Shetty,"Ajay Devgn, Tusshar Kapoor, Arshad Warsi, Sharman Joshi, Paresh Rawal, Rimi Sen, Sushmita Mukherjee, Vrajesh Hirjee",India,"December 31, 2019",2006,TV-14,148 min,"Comedies, International Movies","Between thwarting crooks and wooing the belle next door, four pranksters get in over their heads when they bamboozle their way into a couple’s bungalow.","Between thwarting crooks and wooing the belle next door, four pranksters get in over their heads when they bamboozle their way into a couple’s bungalow. Comedies, International Movies",0
s7910,Movie,Russell Peters: Notorious,Dave Higby,Russell Peters,United States,"October 14, 2013",2013,NR,72 min,Stand-Up Comedy,"Global comedy star Russell Peters leaves no ethnic or cultural stereotype unsatirized in this outrageous standup appearance in Sydney, Australia.","Global comedy star Russell Peters leaves no ethnic or cultural stereotype unsatirized in this outrageous standup appearance in Sydney, Australia. Stand-Up Comedy",2
s5207,TV Show,W1A,,"Hugh Bonneville, Monica Dolan, Jessica Hynes, Rufus Jones, Sarah Parish, Nina Sosanya, Jason Watkins, Hugh Skinner, David Westhead, Jonathan Bailey, Ophelia Lovibond, David Tennant",United Kingdom,"October 24, 2017",2017,TV-MA,3 Seasons,"British TV Shows, TV Comedies","The new Head of Values at the BBC deals with redefining the company's purpose, events like the arrival of Prince Charles and issues with new programs.","The new Head of Values at the BBC deals with redefining the company's purpose, events like the arrival of Prince Charles and issues with new programs. British TV Shows, TV Comedies",1
s8645,TV Show,Twin Peaks,,"Kyle MacLachlan, Michael Ontkean, Mädchen Amick, Dana Ashbrook, Richard Beymer, Lara Flynn Boyle, Sherilyn Fenn, Warren Frost, Peggy Lipton, James Marshall, Everett McGill, Jack Nance, Joan Chen, Kimmy Robertson, Michael Horse, Piper Laurie, Harry Goaz, Eric DaRe, Wendy Robie, Ray Wise, Sheryl Lee, Russ Tamblyn, Don S. Davis, Chris Mulkey, Gary Hershberger, Grace Zabriskie",United States,"July 1, 2017",1990,TV-14,2 Seasons,"Classic & Cult TV, Crime TV Shows, TV Dramas","""Who killed Laura Palmer?"" is the question on everyone's lips in a secretive small town, but as an eccentric FBI agent learns, the answer isn't easy.","""Who killed Laura Palmer?"" is the question on everyone's lips in a secretive small town, but as an eccentric FBI agent learns, the answer isn't easy. Classic & Cult TV, Crime TV Shows, TV Dramas",3
s8693,Movie,Walk with Me,"Marc Francis, Max Pugh","Benedict Cumberbatch, Thich Nhat Hanh",United Kingdom,"December 26, 2017",2017,TV-PG,94 min,Documentaries,A community of monks in France led by Zen Buddhist master Thich Nhat Hanh offers an intimate glimpse into mindfulness practice and the monastic life.,A community of monks in France led by Zen Buddhist master Thich Nhat Hanh offers an intimate glimpse into mindfulness practice and the monastic life. Documentaries,0
s234,Movie,Count Me In,Mark Lo,,United Kingdom,"August 24, 2021",2021,TV-MA,82 min,"Documentaries, Music & Musicals",This documentary features some of rock's greatest drummers as they come together in an inspiring rhythmic journey about the power of human connection.,"This documentary features some of rock's greatest drummers as they come together in an inspiring rhythmic journey about the power of human connection. Documentaries, Music & Musicals",0
s5041,Movie,Love Per Square Foot,Anand Tiwari,"Vicky Kaushal, Angira Dhar, Alankrita Sahai, Raghuvir Yadav, Ratna Pathak Shah, Supriya Pathak",India,"February 14, 2018",2018,TV-14,133 min,"Comedies, International Movies, Romantic Movies","Individually, bank employees Sanjay and Karina don't earn enough to be able to buy a home, so they decide to enter into a marriage of convenience.","Individually, bank employees Sanjay and Karina don't earn enough to be able to buy a home, so they decide to enter into a marriage of convenience. Comedies, International Movies, Romantic Movies",1
s2933,Movie,Fronteras,Andrew Dean,"Steve Oropeza, Steven Sean Garland, Wade Everett, Randy Green, Cortez Chappell, Tori Osborn, Larry Coulter, Cris Acosta",United States,"February 9, 2020",2018,TV-MA,106 min,"Dramas, Independent Movies, Thrillers","When a new, deadly narcotic sweeps the American Southwest, a Border Patrol agent must contend with a task force that challenges his duties and morals.","When a new, deadly narcotic sweeps the American Southwest, a Border Patrol agent must contend with a task force that challenges his duties and morals. Dramas, Independent Movies, Thrillers",0
s5690,Movie,Reggie Watts: Spatial,Benjamin Dickinson,Reggie Watts,United States,"December 6, 2016",2016,TV-MA,62 min,"Music & Musicals, Stand-Up Comedy","The comic innovator delivers a surreal set blending experimental songs, jokes about grits, guns and drugs, and other improvised comedy adventures.","The comic innovator delivers a surreal set blending experimental songs, jokes about grits, guns and drugs, and other improvised comedy adventures. Music & Musicals, Stand-Up Comedy",2
s5949,Movie,The Ryan White Story,John Herzfeld,"Judith Light, Lukas Haas, Michael Bowen, Nikki Cox, George Dzundza, Valerie Landsburg, Sarah Jessica Parker, Mitchell Ryan",United States,"October 1, 2011",1989,TV-PG,94 min,Dramas,"After contracting HIV from a tainted blood treatment, teenaged hemophiliac Ryan White is forced to fight for his right to attend public school.","After contracting HIV from a tainted blood treatment, teenaged hemophiliac Ryan White is forced to fight for his right to attend public school. Dramas",0
s8027,Movie,Sinister Circle,Dorian Fernández-Moris,"Milene Vázquez, Matías Raygada, Claudia Dammert, Marcello Rivera, Atilia Boschetti, Hernán Romero, Ismael Contreras, Pietro Sibille, Leslie Shaw",Peru,"October 1, 2019",2017,TV-MA,87 min,"Horror Movies, International Movies",A psychologist and her mute son confront evil forces at the site of a terrible tragedy involving an ancestral Ouija board and a demonic secret society.,"A psychologist and her mute son confront evil forces at the site of a terrible tragedy involving an ancestral Ouija board and a demonic secret society. Horror Movies, International Movies",0
s3967,Movie,The Highwaymen,John Lee Hancock,"Kevin Costner, Woody Harrelson, Kathy Bates, John Carroll Lynch, Thomas Mann, Kim Dickens, W. Earl Brown, William Sadler",United States,"March 29, 2019",2019,R,132 min,Dramas,Two steely former Texas Rangers are tasked with tracking and killing infamous criminals Bonnie and Clyde in this crime drama based on real events.,Two steely former Texas Rangers are tasked with tracking and killing infamous criminals Bonnie and Clyde in this crime drama based on real events. Dramas,0
s6379,TV Show,Bringing Sexy Back,,Samantha Armstrong,,"October 2, 2019",2015,TV-14,1 Season,"International TV Shows, Reality TV","In this reality series, everyday individuals adopt healthier lifestyles and transform their bodies to reclaim their confidence – with dramatic results.","In this reality series, everyday individuals adopt healthier lifestyles and transform their bodies to reclaim their confidence – with dramatic results. International TV Shows, Reality TV",1
s1517,TV Show,Home for Christmas,,"Ida Elise Broch, Gabrielle Susanne Solheim Leithaug, Dennis Storhøi, Anette Hoff, Felix Sandman, Ghita Nørby, Hege Schøyen, Bjørn Skagestad, Mads Sjøgård Pettersen",Norway,"December 18, 2020",2020,TV-MA,2 Seasons,"International TV Shows, Romantic TV Shows, TV Comedies","Tired of the constant comments on her relationship status, perpetually single Johanne starts a 24-day hunt for a boyfriend to bring home for Christmas.","Tired of the constant comments on her relationship status, perpetually single Johanne starts a 24-day hunt for a boyfriend to bring home for Christmas. International TV Shows, Romantic TV Shows, TV Comedies",1
s8524,TV Show,The Super Mario Bros. Super Show!,,"Captain Lou Albano, Danny Wells, Jeannie Elias, John Stocker, Harvey Atkin, Robert Bockstael, Cynthia Preston, Jonathan Potts, Colin Fox","United States, Canada","May 22, 2016",1989,TV-Y7,1 Season,Kids' TV,"Mixing live action and animation, this classic series brought the beloved Super Mario Bros. video game characters to television screens everywhere.","Mixing live action and animation, this classic series brought the beloved Super Mario Bros. video game characters to television screens everywhere. Kids' TV",1
s8733,Movie,White Chamber,Paul Raschid,"Shauna MacDonald, Oded Fehr, Amrita Acharia, Sharon Maughan, Nicholas Farrell, Candis Nergaard, Marcus Griffiths, Adrianna Edwards, Sumit Chakravarti, Lisa Reynolds",United Kingdom,"August 1, 2019",2018,TV-MA,89 min,"Sci-Fi & Fantasy, Thrillers","When a civil war ravages the UK, a scientist awakens in a futuristic cell and is tortured by her captor for information she claims she doesn't possess.","When a civil war ravages the UK, a scientist awakens in a futuristic cell and is tortured by her captor for information she claims she doesn't possess. Sci-Fi & Fantasy, Thrillers",4
s7188,TV Show,Khotey Sikkey,,"Vikas Kumar, Hassan Zaidi, Sukhmani Sadana, Puru Chibber, Dilkhush, Mark Farokh Parakh",India,"March 15, 2018",2011,TV-14,1 Season,"Crime TV Shows, International TV Shows, TV Dramas",Five affluent youths find a new sense of purpose as they team up with a Mumbai police officer on crime-busting missions around the city.,"Five affluent youths find a new sense of purpose as they team up with a Mumbai police officer on crime-busting missions around the city. Crime TV Shows, International TV Shows, TV Dramas",3
s1729,Movie,The Endless Trench,"Aitor Arregi, Jon Garaño, Jose Mari Goenaga","Antonio de la Torre, Belén Cuesta, Vicente Vergara, José Manuel Poga, Emilio Palacios","Spain, France, Canada","November 6, 2020",2019,TV-MA,148 min,"Dramas, Independent Movies, International Movies","Fearing retribution, a Republican from the Spanish Civil War hides in his home for more than 30 years with the help of his wife. Based on true events.","Fearing retribution, a Republican from the Spanish Civil War hides in his home for more than 30 years with the help of his wife. Based on true events. Dramas, Independent Movies, International Movies",0
s1422,Movie,The Intouchables,"Olivier Nakache, Éric Toledano","François Cluzet, Omar Sy, Anne Le Ny, Audrey Fleurot, Joséphine de Meaux, Clotilde Mollet, Alba Gaïa Kraghede Bellugi, Cyril Mendy",France,"January 11, 2021",2011,R,112 min,"Comedies, Dramas, International Movies","In need of a caregiver, a wealthy aristocrat with quadriplegia hires the last person anyone expects: an ex-con with no experience. Based on a true story.","In need of a caregiver, a wealthy aristocrat with quadriplegia hires the last person anyone expects: an ex-con with no experience. Based on a true story. Comedies, Dramas, International Movies",0
s1923,TV Show,The Parkers,,"Mo'Nique, Countess Vaughn, Dorien Wilson, Jenna von Oÿ, Ken Lawson, Yvette Wilson",United States,"October 1, 2020",2003,TV-PG,5 Seasons,TV Comedies,"In this ""Moesha"" spinoff, undergraduate Kim is joined at Santa Monica College by her mother Nikki, who decides to go back to school with her daughter.","In this ""Moesha"" spinoff, undergraduate Kim is joined at Santa Monica College by her mother Nikki, who decides to go back to school with her daughter. TV Comedies",1
s320,TV Show,The Prince Who Turns into a Frog,,"Joe Chen, Ming Dao, Sam Wang, Joyce Chao, Gino, Su Li-hsin, Wang Chuan, Ehlo Huang",Taiwan,"August 3, 2021",2005,TV-14,1 Season,"International TV Shows, Romantic TV Shows, TV Comedies","Before his wedding, a cold CEO is hit by a car and awakens a changed man. As he and the driver fall in love, more changes appear on the road ahead.","Before his wedding, a cold CEO is hit by a car and awakens a changed man. As he and the driver fall in love, more changes appear on the road ahead. International TV Shows, Romantic TV Shows, TV Comedies",3
