show_id,type,title,director,cast,country,date_added,release_year,rating,duration,listed_in,description,combined_text,cluster
s625,Movie,Prime Time,Jakub Piątek,"Bartosz Bielenia, Magdalena Popławska, Andrzej Kłak, Małgorzata Hajewska, Dobromir Dymecki, Monika Frajczyk, Cezary Kosiński, Adam Nawojczyk, Juliusz Chrząstowski",,"June 30, 2021",2021,TV-MA,92 min,"Dramas, International Movies, Thrillers","On New Year’s Eve 1999, an armed man enters a TV studio during a broadcast, takes the host hostage and makes one demand: to give a message live on air.","On New Year’s Eve 1999, an armed man enters a TV studio during a broadcast, takes the host hostage and makes one demand: to give a message live on air. Dramas, International Movies, Thrillers",1
s2145,TV Show,GAME ON: A Comedy Crossover Event,,"Loretta Devine, Tia Mowry-Hardrict, Anthony Alabi, Paul Wight, Allison Munn, Gabriel Iglesias, Sherri Shepherd, Paulina Chávez, Jencarlos Canela",United States,"August 10, 2020",2020,TV-G,1 Season,"Kids' TV, TV Comedies","Worlds collide in this special event featuring familiar faces, surprise cameos and stories of spirited competition from four different comedy series.","Worlds collide in this special event featuring familiar faces, surprise cameos and stories of spirited competition from four different comedy series. Kids' TV, TV Comedies",1
s1492,Movie,AK vs AK,Vikramaditya Motwane,"Anil Kapoor, Anurag Kashyap",India,"December 25, 2020",2020,TV-MA,109 min,"Comedies, Dramas, International Movies","After a public spat with a movie star, a disgraced director retaliates by kidnapping the actor’s daughter, filming the search for her in real time.","After a public spat with a movie star, a disgraced director retaliates by kidnapping the actor’s daughter, filming the search for her in real time. Comedies, Dramas, International Movies",1
s6753,Movie,Filosofi Kopi The Movie,Angga Dwimas Sasongko,"Chicco Jerikho, Rio Dewanto, Julie Estelle, Jajang C. Noer, Slamet Rahardjo, Otig Pakis, Arash Buana, Hazel Raditya, Dimas Harya, Westny Dj",Indonesia,"October 11, 2018",2015,TV-PG,118 min,"Dramas, International Movies",The level-headed owner of a struggling coffee shop finds his future at risk when his partner – a talented but cocky barista – makes a major bet.,"The level-headed owner of a struggling coffee shop finds his future at risk when his partner – a talented but cocky barista – makes a major bet. Dramas, International Movies",0
s1023,Movie,Taare Zameen Par,Aamir Khan,"Aamir Khan, Darsheel Safary, Tanay Chheda, Tisca Chopra, Vipin Sharma, Girija Oak, M.K. Raina",India,"April 17, 2021",2007,PG,162 min,"Dramas, International Movies","When daydreamer Ishaan is sent to boarding school, an unconventional art teacher tries to help the imaginative student discover his true identity.","When daydreamer Ishaan is sent to boarding school, an unconventional art teacher tries to help the imaginative student discover his true identity. Dramas, International Movies",0
s7367,Movie,Macchli Jal Ki Rani Hai,Debaloy Dey,"Swara Bhaskar, Bhanu Uday, Murli Sharma, Deep Raj Rana, Reema Debnath, Hemant Pandey, Saurabh Dubey, Sakha Kalyani",India,"October 15, 2017",2014,TV-MA,118 min,"Horror Movies, International Movies","After relocating to a different town with her husband, a housewife begins to sense the existence of a mysterious presence in their new house.","After relocating to a different town with her husband, a housewife begins to sense the existence of a mysterious presence in their new house. Horror Movies, International Movies",0
s1056,Movie,Zoot Suit,Luis Valdez,"Daniel Valdez, Edward James Olmos, Charles Aidman, Tyne Daly, John Anderson, Abel Franco, Mike Gomez, Francis X. McCarthy, Alma Martínez, Lupe Ontiveros, Tony Plana",United States,"April 15, 2021",1981,R,103 min,"Cult Movies, Dramas, Music & Musicals","In this drama based on a 1940s trial, the members of a Mexican American gang are sentenced to San Quentin for a murder they may not have committed.","In this drama based on a 1940s trial, the members of a Mexican American gang are sentenced to San Quentin for a murder they may not have committed. Cult Movies, Dramas, Music & Musicals",0
s6436,Movie,Cave,Henrik Martin Dahlsbakken,"Heidi Toini, Benjamin Helstad, Mads Sjogard Pettersen, Ingar Helge Gimle",Norway,"June 15, 2017",2016,TV-MA,77 min,"Action & Adventure, International Movies, Thrillers","Torn between old camaraderie and recent tensions, three ex-soldiers reunite to explore a deadly cave but soon discover terror beyond all expectations.","Torn between old camaraderie and recent tensions, three ex-soldiers reunite to explore a deadly cave but soon discover terror beyond all expectations. Action & Adventure, International Movies, Thrillers",0
s7509,Movie,Moonwalkers,Antoine Bardou-Jacquet,"Ron Perlman, Rupert Grint, Robert Sheehan, Stephen Campbell Moore, Eric Lampaert, Kevin Bishop, Tom Audenaert, Erika Sainte","France, Belgium","September 8, 2017",2015,R,96 min,"Action & Adventure, Comedies, International Movies","A brain-addled war vet, a failing band manager and a Stanley Kubrick impersonator help the CIA construct an epic scam by faking the 1969 moon landing.","A brain-addled war vet, a failing band manager and a Stanley Kubrick impersonator help the CIA construct an epic scam by faking the 1969 moon landing. Action & Adventure, Comedies, International Movies",0
s4327,TV Show,The Sound of Your Heart: Reboot,,"Sung Hoon, Kwon Yuri, Tae Hang-ho, Joo Jin-mo, Shim Hye-jin, Ji Su-won, Park Cheol-min, Kim Seong-won, Kang Yoon, Seo Eun-ah, Bae Yoon-kyung",South Korea,"December 3, 2018",2018,TV-14,2 Seasons,"International TV Shows, Korean TV Shows, TV Comedies","Webtoonist Cho Seok is back with more anecdotes of mix-ups, unintended antics, and bathroom blunders in this reboot starring an all-new cast.","Webtoonist Cho Seok is back with more anecdotes of mix-ups, unintended antics, and bathroom blunders in this reboot starring an all-new cast. International TV Shows, Korean TV Shows, TV Comedies",3
s5545,Movie,Deuces,Jamal Hill,"Larenz Tate, Meagan Good, Lance Gross, Antonique Smith, La La Anthony, Rick Gonzalez, Rotimi, Andra Fuller",United States,"April 1, 2017",2016,TV-MA,88 min,Dramas,"Assigned to go undercover to take down an impenetrable crime ring, a detective finds himself falling under the sway of its enigmatic leader.","Assigned to go undercover to take down an impenetrable crime ring, a detective finds himself falling under the sway of its enigmatic leader. Dramas",0
s3529,Movie,Bill Burr: Paper Tiger,Mike Binder,Bill Burr,"United States, United Kingdom","September 10, 2019",2019,TV-MA,67 min,Stand-Up Comedy,"Bill Burr unloads on outrage culture, male feminism, cultural appropriation, robot sex and more in a blistering stand-up special shot in London.","Bill Burr unloads on outrage culture, male feminism, cultural appropriation, robot sex and more in a blistering stand-up special shot in London. Stand-Up Comedy",2
s966,TV Show,Yasuke,,"LaKeith Stanfield, Takehiro Hira, Maya Tanida, Ian Chen, Gwendoline Yeo, Ming-Na Wen, Noshir Dalal, Paul Nakauchi, Darren Criss, Dia Frampton, William Christopher Stephens, Julie Marcus, Greg Chun, Dan Donohue, Johnny Yong Bosch, Michael Sinterniklaas, Amy Hill, Emily Woo Zeller, Keone Young",,"April 29, 2021",2021,TV-MA,1 Season,"Anime Series, International TV Shows",A peaceful boatman once known as the Black Samurai is pulled back into conflict when he takes a little girl with mysterious powers under his wing.,"A peaceful boatman once known as the Black Samurai is pulled back into conflict when he takes a little girl with mysterious powers under his wing. Anime Series, International TV Shows",1
s4872,Movie,My Fuhrer,Dani Levy,"Helge Schneider, Ulrich Mühe, Sylvester Groth, Adriana Altaras, Stefan Kurt, Ulrich Noethen, Lambert Hamel, Udo Kroschwald, Torsten Michaelis, Axel Werner",Germany,"May 7, 2018",2007,TV-14,91 min,"Comedies, International Movies",Germany's most celebrated actor is commissioned by Nazi propagandist Joseph Goebbels to prepare the leader of the Third Reich to deliver a speech.,"Germany's most celebrated actor is commissioned by Nazi propagandist Joseph Goebbels to prepare the leader of the Third Reich to deliver a speech. Comedies, International Movies",0
s5585,Movie,Nila,Selvamani Selvaraj,"Sruthi Hariharan, Vicky R",India,"March 1, 2017",2016,TV-MA,94 min,"Dramas, International Movies, Romantic Movies","When a cabbie chances upon his childhood sweetheart, he tries to rekindle old feelings but finds that mature love is a more complicated matter.","When a cabbie chances upon his childhood sweetheart, he tries to rekindle old feelings but finds that mature love is a more complicated matter. Dramas, International Movies, Romantic Movies",0
s8374,TV Show,The Jungle Book,,"Emma Tate, Jimmy Hibbert, Sam Gold, David Holt, Joseph J. Terry","India, Germany, France","May 11, 2019",2010,TV-Y7,1 Season,Kids' TV,"This animated series follows young Mowgli and his animal mentors Bagheera and Baloo, who do their best to protect him from fierce tiger Shere Khan.","This animated series follows young Mowgli and his animal mentors Bagheera and Baloo, who do their best to protect him from fierce tiger Shere Khan. Kids' TV",1
s6579,Movie,Deadly Scholars,Danny J. Boyle,"Kennedy Lea Slocum, Corey Fogelmanis, Alexa Mansour, Peyton Clark, Sheryl Lee, Sherri Saum, Eric Stanton Betts, Paris Berelc, Pedro Correa, Alissa Latow",United States,"February 15, 2019",2018,TV-14,86 min,"Dramas, Thrillers","After a series of strange deaths, a high school reporter tries to pin down the killer who's targeting students eligible for a prestigious scholarship.","After a series of strange deaths, a high school reporter tries to pin down the killer who's targeting students eligible for a prestigious scholarship. Dramas, Thrillers",3
s6969,Movie,Highly Strung,Scott Hicks,,Australia,"February 1, 2017",2015,TV-14,80 min,"Documentaries, International Movies, Music & Musicals","Fiery passions take center stage in this intimate look at the Australian String Quartet and, perhaps more vital, the priceless instruments they guard.","Fiery passions take center stage in this intimate look at the Australian String Quartet and, perhaps more vital, the priceless instruments they guard. Documentaries, International Movies, Music & Musicals",0
s4388,TV Show,Vai Anitta,,Anitta,Brazil,"November 16, 2018",2018,TV-MA,1 Season,"Docuseries, International TV Shows, Reality TV","Go behind the scenes with Brazilian pop icon Anitta, along with her friends and family, as she aims to create a new song and music video each month.","Go behind the scenes with Brazilian pop icon Anitta, along with her friends and family, as she aims to create a new song and music video each month. Docuseries, International TV Shows, Reality TV",1
s3214,Movie,Lagos Real Fake Life,Mike Ezuruonye,"Nonso Diobi, Mike Ezuruonye, Mercy Aigbe, Rex Nosa, Annie Macaulay Idibia, Ik Ogbonna, Nedu Wazobia, Uzee Usman, Odunlade Adekola, Mr Jollof, Efe Irele, Josh 2 Funny, Haillie Sumney, Emmanuella, MC Lively",,"November 29, 2019",2018,TV-MA,118 min,"Comedies, International Movies","Two mooching friends vie for the attention of wealthy, beautiful women only to discover that their lavish lifestyles are bogus.","Two mooching friends vie for the attention of wealthy, beautiful women only to discover that their lavish lifestyles are bogus. Comedies, International Movies",0
s8578,Movie,This Was Tomorrow,Wim Bonte,,Belgium,"December 15, 2015",2015,NR,77 min,"Documentaries, International Movies, Music & Musicals","The Tomorrowland music festival marks its 10th anniversary in Belgium, the U.S. and Brazil, with all the diverse excitement of the annual event.","The Tomorrowland music festival marks its 10th anniversary in Belgium, the U.S. and Brazil, with all the diverse excitement of the annual event. Documentaries, International Movies, Music & Musicals",0
s1006,Movie,Keymon and Nani in Space Adventure,,,,"April 20, 2021",2013,TV-Y,76 min,"Children & Family Movies, Comedies","For Rohan and his magical pal, Keymon, a trip to visit their grandmother turns into the rescue mission of a lifetime when she is kidnapped by aliens!","For Rohan and his magical pal, Keymon, a trip to visit their grandmother turns into the rescue mission of a lifetime when she is kidnapped by aliens! Children & Family Movies, Comedies",0
s8786,TV Show,YOM,,"Sairaj, Devyani Dagaonkar, Ketan Singh, Mayur Vyas, Ketan Kava",,"June 7, 2018",2016,TV-Y7,1 Season,Kids' TV,"With the mind of a human being, and the body of whichever animal he chooses to be, a young boy protects the world from danger.","With the mind of a human being, and the body of whichever animal he chooses to be, a young boy protects the world from danger. Kids' TV",1
s6337,Movie,Blood Father,Jean-François Richet,"Mel Gibson, Erin Moriarty, Diego Luna, Michael Parks, William H. Macy, Miguel Sandoval, Dale Dickey, Richard Cabral, Daniel Moncada, Ryan Dorsey",France,"March 26, 2020",2016,R,88 min,"Action & Adventure, International Movies",An ex-convict and estranged father finds the chance to prove himself when his daughter seeks his help shaking off a dangerous group of drug dealers.,"An ex-convict and estranged father finds the chance to prove himself when his daughter seeks his help shaking off a dangerous group of drug dealers. Action & Adventure, International Movies",0
s8682,Movie,Vitti Dandu,Ganesh Kadam,"Dilip Prabhavalkar, Ashok Samarth, Yatin Karyekar, Nishant Bhavsar, Mrunal Thakur, Vikas Kadam, Utpal Sawant, Ravindra Mankani, Shubhankar Atre, Charudatta Bhagwat",India,"July 15, 2017",2014,TV-14,116 min,"Dramas, International Movies","In a remote village in colonial India, an old man and his grandson display strong differences in their attitudes toward the country's British rulers.","In a remote village in colonial India, an old man and his grandson display strong differences in their attitudes toward the country's British rulers. Dramas, International Movies",0
s4354,TV Show,Death by Magic,,Drummond Money-Coutts,United States,"November 30, 2018",2018,TV-PG,1 Season,Reality TV,"Magician Drummond Money-Coutts travels the globe, sharing his infectious love of his craft and attempting feats that proved fatal to other magicians.","Magician Drummond Money-Coutts travels the globe, sharing his infectious love of his craft and attempting feats that proved fatal to other magicians. Reality TV",0
s4997,Movie,Bullet Head,"Paul Solet, Rick Benattar","Adrien Brody, John Malkovich, Rory Culkin, Antonio Banderas, Ori Pfeffer, Alexandra Dinu, Owen Davis, Deyan Petrov","Bulgaria, United States","March 7, 2018",2017,R,94 min,"International Movies, Thrillers","After a daring heist, three fugitives lock themselves in a warehouse hoping to evade the police, but find a worse threat as they fight to stay alive.","After a daring heist, three fugitives lock themselves in a warehouse hoping to evade the police, but find a worse threat as they fight to stay alive. International Movies, Thrillers",0
s7913,Movie,S.W.A.T.,Clark Johnson,"Samuel L. Jackson, Colin Farrell, Michelle Rodriguez, LL Cool J, Josh Charles, Jeremy Renner, Brian Van Holt, Olivier Martinez, Reg E. Cathey, Larry Poindexter, Page Kennedy, Domenick Lombardozzi, James DuMont",United States,"January 1, 2021",2003,PG-13,117 min,Action & Adventure,"A veteran cop is tasked with drafting and training a special weapons and tactics team, who soon find themselves up against an international criminal.","A veteran cop is tasked with drafting and training a special weapons and tactics team, who soon find themselves up against an international criminal. Action & Adventure",0
s7434,Movie,Medium,Jacek Koprowicz,"Władysław Kowalski, Michał Bajor, Jerzy Zelnik, Jerzy Stuhr, Grażyna Szapołowska, Jerzy Nowak, Ewa Dałkowska, Piotr Machalica, Zygmunt Zintel, Henryk Bista","Poland, West Germany","October 1, 2019",1985,TV-MA,90 min,"Horror Movies, International Movies, Thrillers","In 1930s Poland, a powerful psychic steers a group of strangers toward a fated convergence that ensures survival for one and annihilation for others.","In 1930s Poland, a powerful psychic steers a group of strangers toward a fated convergence that ensures survival for one and annihilation for others. Horror Movies, International Movies, Thrillers",0
s1545,Movie,Grizzlies,Miranda de Pencier,"Ben Schnetzer, Emerald MacDonald, Booboo Stewart, Will Sasso, Paul Nutarariaq, Ricky Marty-Pahtaykan, Tantoo Cardinal, Eric Schweig",Canada,"December 15, 2020",2018,R,106 min,"Dramas, Independent Movies, Sports Movies",A group of disaffected students form an unlikely bond through the game of lacrosse when a new teacher introduces the sport to their remote Arctic town.,"A group of disaffected students form an unlikely bond through the game of lacrosse when a new teacher introduces the sport to their remote Arctic town. Dramas, Independent Movies, Sports Movies",0
s4624,TV Show,Skylanders Academy,,"Justin Long, Ashley Tisdale, Jonathan Banks, Chris Diamantopoulos, Bobcat Goldthwait, Richard Steven Horvitz, Norm MacDonald, Daniel Middleton, Catherine O'Hara, Parker Posey, Jonny Rees, Jason Ritter, Susan Sarandon, Harland Williams, Daniel Wu, Dee Bradley Baker, Chris Cox, Jim Cummings, Felicia Day, John DiMaggio, Grey Griffin","South Korea, United States","September 28, 2018",2018,TV-Y7,3 Seasons,"Kids' TV, TV Comedies",Travel the vast Skylander universe in this animated series as a ragtag group of academy graduates build trust and heart in their fight against evil.,"Travel the vast Skylander universe in this animated series as a ragtag group of academy graduates build trust and heart in their fight against evil. Kids' TV, TV Comedies",1
s8403,Movie,The Longshots,Fred Durst,"Ice Cube, Keke Palmer, Tasha Smith, Jill Marie Jones, Dash Mihok, Matt Craven, Glenn Plummer, Garrett Morris, Miles Chandler, Malcolm Goodwin",United States,"January 30, 2019",2008,PG,95 min,"Comedies, Dramas, Sports Movies","When an 11-year-old girl becomes Pop Warner football's first female quarterback, she raises eyebrows – till she takes her team to the brink of glory.","When an 11-year-old girl becomes Pop Warner football's first female quarterback, she raises eyebrows – till she takes her team to the brink of glory. Comedies, Dramas, Sports Movies",0
s3937,TV Show,Derek,,"Ricky Gervais, Kerry Godliman, Karl Pilkington, David Earl, Kay Noone, Tim Barlow, Arthur Nightingale, Sheila Collings, Margaret Towner, Barry Martin, Prem Modgil, Blanche Williams, Ninette Finch, Brett Goldstein, Ruth Bratt, Holli Dempsey",United Kingdom,"April 5, 2019",2015,TV-MA,3 Seasons,"British TV Shows, International TV Shows, TV Comedies",Ricky Gervais created and stars in this heartwarming comedy-drama series as a loyal English nursing home caretaker who sees only the good in everyone.,"Ricky Gervais created and stars in this heartwarming comedy-drama series as a loyal English nursing home caretaker who sees only the good in everyone. British TV Shows, International TV Shows, TV Comedies",3
s2133,Movie,Project Power,"Henry Joost, Ariel Schulman","Jamie Foxx, Joseph Gordon-Levitt, Dominique Fishback, Rodrigo Santoro, Courtney B. Vance, Amy Landecker, Machine Gun Kelly, Tait Fletcher, Allen Maldonado, Andrene Ward-Hammond",United States,"August 14, 2020",2020,R,113 min,Action & Adventure,"An ex-soldier, a teen and a cop collide in New Orleans as they hunt for the source behind a dangerous new pill that grants users temporary superpowers.","An ex-soldier, a teen and a cop collide in New Orleans as they hunt for the source behind a dangerous new pill that grants users temporary superpowers. Action & Adventure",0
s322,TV Show,Two Fathers,,"Weber Yang, Lin Yo-Wei, Megan Lai, Amanda Chou, Lucia Xie, Cherry Leung",Taiwan,"August 3, 2021",2013,TV-14,1 Season,"International TV Shows, Romantic TV Shows, TV Comedies","When two single guys learn a woman they both slept with disappeared after giving birth, they decide to raise her baby girl together as a family.","When two single guys learn a woman they both slept with disappeared after giving birth, they decide to raise her baby girl together as a family. International TV Shows, Romantic TV Shows, TV Comedies",1
s8222,Movie,The Boy,William Brent Bell,"Jim Norton, Rupert Evans, Ben Robson, Lauren Cohan, James Russell, Jett Klyne, Diana Hardcastle","United States, Canada, China","June 1, 2020",2016,PG-13,97 min,"Horror Movies, Independent Movies, Thrillers",A nanny is hired by a couple to look after their boy. She's shocked to learn that her charge is actually a doll that the couple treats like a human.,"A nanny is hired by a couple to look after their boy. She's shocked to learn that her charge is actually a doll that the couple treats like a human. Horror Movies, Independent Movies, Thrillers",0
s24,Movie,Go! Go! Cory Carson: Chrissy Takes the Wheel,"Alex Woo, Stanley Moore","Maisie Benson, Paul Killam, Kerry Gudjohnsen, AC Lim",,"September 21, 2021",2021,TV-Y,61 min,Children & Family Movies,"From arcade games to sled days and hiccup cures, Cory Carson’s curious little sister Chrissy speeds off on her own for fun and adventure all over town!","From arcade games to sled days and hiccup cures, Cory Carson’s curious little sister Chrissy speeds off on her own for fun and adventure all over town! Children & Family Movies",0
s4595,Movie,Naughty Jatts,Pankaj Batra,"Neeru Bajwa, Binnu Dhillon, Arya Babbar, Roshan Prince, B.N. Sharma, Karamjit Anmol, Harby Sangha",India,"October 1, 2018",2013,TV-PG,121 min,"Comedies, International Movies, Music & Musicals","When three different boys propose to a lively, strictly reared girl who yearns to be a performer, she agrees to marry the winner of a singing contest.","When three different boys propose to a lively, strictly reared girl who yearns to be a performer, she agrees to marry the winner of a singing contest. Comedies, International Movies, Music & Musicals",0
s7528,Movie,Murder Party,Jeremy Saulnier,"Alex Barnett, Macon Blair, Paul Goldblatt, Stacy Rock, William Lacey, Beau Sia, Skei Saulnier, Chris Sharp, Bill Tangradi",United States,"September 1, 2018",2007,NR,79 min,"Comedies, Cult Movies, Horror Movies","A mild-mannered office drone plucks a Halloween party invitation off the street and suddenly finds himself the main event at a ""murder party.""","A mild-mannered office drone plucks a Halloween party invitation off the street and suddenly finds himself the main event at a ""murder party."" Comedies, Cult Movies, Horror Movies",0
s3481,Movie,TUNA GIRL,Mana Yasuda,"Fuka Koshiba, Tom Fujita, Hidetoshi Hoshida, Hiroto Kanai, Ryosuke Yusa, Shuri Tanaka, Chal Inoue, Takashi Taniguchi, Takeshi Masu",Japan,"September 28, 2019",2019,TV-PG,90 min,"Dramas, International Movies",A clumsy but cheerful fisheries student struggles to find her place at a research institute renowned for its tuna cultivation. The work isn't easy.,"A clumsy but cheerful fisheries student struggles to find her place at a research institute renowned for its tuna cultivation. The work isn't easy. Dramas, International Movies",0
s2317,Movie,The Silence of Others,"Almudena Carracedo, Robert Bahar",,"Spain, France, Canada, United States","July 1, 2020",2019,TV-14,96 min,"Documentaries, International Movies","Filmed over six years, this documentary captures the struggles of victims who suffered abuse under Gen. Francisco Franco's regime as they seek justice.","Filmed over six years, this documentary captures the struggles of victims who suffered abuse under Gen. Francisco Franco's regime as they seek justice. Documentaries, International Movies",0
s497,Movie,Brick Mansions,Camille Delamarre,"Paul Walker, David Belle, RZA, Gouchy Boy, Catalina Denis, Ayisha Issa, Carlo Rota, Andreas Apergis, Richard Zeman, Robert Maillet","France, Canada, United States, Spain","July 7, 2021",2014,PG-13,90 min,"Action & Adventure, International Movies",An undercover police detective partners with an ex-convict to take down a drug kingpin amid grime and crime in a walled-off Detroit housing project.,"An undercover police detective partners with an ex-convict to take down a drug kingpin amid grime and crime in a walled-off Detroit housing project. Action & Adventure, International Movies",0
s1323,Movie,Growing up and other problems,Clara Martínez-Lázaro,"Silvia Alonso, Bárbara Goenaga, María Esteve, Vito Sanz, Francesco Carril",Spain,"February 11, 2021",2018,TV-14,91 min,"Comedies, Dramas, International Movies",A 30-something woman without a steady partner or income samples stability when her pregnant best friend asks her to be the godmother of her child.,"A 30-something woman without a steady partner or income samples stability when her pregnant best friend asks her to be the godmother of her child. Comedies, Dramas, International Movies",0
s7221,Movie,Knowing,Alex Proyas,"Nicolas Cage, Chandler Canterbury, Rose Byrne, Lara Robinson, D.G. Maloney, Nadia Townsend, Alan Hopgood, Adrienne Pickering","United States, United Kingdom, Australia","October 1, 2019",2009,PG-13,121 min,"Sci-Fi & Fantasy, Thrillers",An MIT astrophysics professor and his son unearth a string of numbers from a time capsule that seem to reveal a cataclysm that will wipe out humanity.,"An MIT astrophysics professor and his son unearth a string of numbers from a time capsule that seem to reveal a cataclysm that will wipe out humanity. Sci-Fi & Fantasy, Thrillers",4
