show_id,type,title,director,cast,country,date_added,release_year,rating,duration,listed_in,description,combined_text,cluster
s7507,Movie,Moon,Duncan Jones,"Sam Rockwell, Kevin Spacey, Dominique McElligott, Rosie Shaw, Adrienne Shaw, Kaya Scodelario, Benedict Wong, Matt Berry, Malcolm Stewart, Robin Chalk","United Kingdom, United States","January 1, 2020",2009,R,97 min,"Dramas, Independent Movies, Sci-Fi & Fantasy","As he nears the end of a lonely three-year stint on the moon base Sarang, astronaut Sam Bell begins to hear and see strange things.","As he nears the end of a lonely three-year stint on the moon base Sarang, astronaut Sam Bell begins to hear and see strange things. Dramas, Independent Movies, Sci-Fi & Fantasy",0
s812,Movie,Super Monsters: Once Upon a Rhyme,Steve Ball,"Elyse Maloway, Vincent Tong, Andrea Libman, Alessandro Juliani, Nicole Anthony, Erin Mathews, Diana Kaarina, Gigi Saul Guerrero, Asia Mattu, Rukiya Bernard, Ian James Corlett, Britt McKillip",,"June 2, 2021",2021,TV-Y,25 min,Children & Family Movies,"From Goldilocks to Hansel and Gretel, the Super Monsters reimagine classic fairy tales and favorite nursery rhymes with a musical, magical spin!","From Goldilocks to Hansel and Gretel, the Super Monsters reimagine classic fairy tales and favorite nursery rhymes with a musical, magical spin! Children & Family Movies",0
s3892,Movie,ReMastered: Devil at the Crossroads,Brian Oakes,,United States,"April 26, 2019",2019,TV-14,49 min,"Documentaries, Music & Musicals","Cloaked in mystery, bluesman Robert Johnson left his mark on American music. Now family, critics and famous fans look for the real man behind the music.","Cloaked in mystery, bluesman Robert Johnson left his mark on American music. Now family, critics and famous fans look for the real man behind the music. Documentaries, Music & Musicals",0
s3969,TV Show,The Terminal,,"Mohammad Mansour, Bouthayna Al Raesi, Bassima Hamada, Ahlaam Muhammed, Shaimaa Ali, Foaz Al -Shatti, Abdullah Bahman, Abdulmohsen Al-Qaffas, Mohammed Al Dosari",,"March 29, 2019",2018,TV-14,1 Season,"International TV Shows, TV Dramas","Social pressure, a complicated past and a clash of values beset the life of a businessman and his family.","Social pressure, a complicated past and a clash of values beset the life of a businessman and his family. International TV Shows, TV Dramas",3
s2030,Movie,The Babysitter: Killer Queen,McG,"Judah Lewis, Jenna Ortega, Emily Alyn Lind, Andrew Bachelor, Robbie Amell, Bella Thorne, Hana Mae Lee, Ken Marino, Leslie Bibb, Chris Wylde, Carl McDowell",United States,"September 10, 2020",2020,TV-MA,102 min,"Comedies, Horror Movies","Two years after Cole survived a satanic blood cult, he's living another nightmare: high school. And the demons from his past? Still making his life hell.","Two years after Cole survived a satanic blood cult, he's living another nightmare: high school. And the demons from his past? Still making his life hell. Comedies, Horror Movies",0
s3255,Movie,Mallesham,Raj R,"Jhansi, Priyadarshi Pullikonda, Ananya Nagalla",India,"November 20, 2019",2019,TV-14,131 min,"Dramas, Independent Movies, International Movies","A self-trained engineer risks debt, love and reputation in his quest to improve the grueling work conditions of his mother and her weaving community.","A self-trained engineer risks debt, love and reputation in his quest to improve the grueling work conditions of his mother and her weaving community. Dramas, Independent Movies, International Movies",0
s6968,Movie,Hide and Seek,Liu Jie,"Wallace Huo, Qin Hailu, Regina Wan, Jessie Li, Dong Zijian, Li Yiqing, Fan Qianhui",China,"August 19, 2017",2016,TV-14,104 min,"International Movies, Thrillers","While living a comfortable life with his wife and child, a germophobic man realizes his estranged brother may have committed a terrible crime.","While living a comfortable life with his wife and child, a germophobic man realizes his estranged brother may have committed a terrible crime. International Movies, Thrillers",0
s4935,Movie,6 Balloons,Marja Lewis Ryan,"Abbi Jacobson, Dave Franco, Jane Kaczmarek, Tim Matheson, Charlotte Carel, Madeline Carel, Maya Erskine, Dawan Owens, Jen Tullock",United States,"April 6, 2018",2018,TV-MA,75 min,"Dramas, Independent Movies",A loyal sister struggles to stay afloat while driving her heroin-addicted brother to a detox center and looking after his 2-year-old daughter.,"A loyal sister struggles to stay afloat while driving her heroin-addicted brother to a detox center and looking after his 2-year-old daughter. Dramas, Independent Movies",0
s6999,TV Show,Horror Homes,,Jill Halfpenny,United Kingdom,"October 2, 2019",2016,TV-14,1 Season,"British TV Shows, Docuseries, International TV Shows","Dream homes turn into property nightmares when mold, maggots, natural disasters and other inconveniences move in.","Dream homes turn into property nightmares when mold, maggots, natural disasters and other inconveniences move in. British TV Shows, Docuseries, International TV Shows",3
s6887,Movie,Gothika,Mathieu Kassovitz,"Halle Berry, Robert Downey Jr., Charles S. Dutton, John Carroll Lynch, Bernard Hill, Penélope Cruz, Dorian Harewood, Bronwen Mantel","United States, France, Canada, Spain","January 1, 2021",2003,R,98 min,"Horror Movies, Thrillers","After a car crash, a criminal psychiatrist awakens to find that she's a patient in the same mental institution that currently employs her.","After a car crash, a criminal psychiatrist awakens to find that she's a patient in the same mental institution that currently employs her. Horror Movies, Thrillers",0
s6867,Movie,GoldenEye,Martin Campbell,"Pierce Brosnan, Sean Bean, Izabella Scorupco, Famke Janssen, Joe Don Baker, Judi Dench, Robbie Coltrane, Gottfried John, Alan Cumming, Tchéky Karyo, Desmond Llewelyn, Samantha Bond, Michael Kitchen, Serena Gordon, Simon Kunz","United Kingdom, United States","December 31, 2019",1995,PG-13,130 min,Action & Adventure,"Pierce Brosnan takes his first turn as debonair secret agent James Bond, who investigates the destruction of a Russian satellite weapons base.","Pierce Brosnan takes his first turn as debonair secret agent James Bond, who investigates the destruction of a Russian satellite weapons base. Action & Adventure",0
s6685,Movie,Elles étaient en guerre 1939-1945,"Hugues Nancy, Fabien Beziat",,,"March 1, 2018",2015,TV-MA,92 min,"Documentaries, International Movies","Mothers, nurses, soldiers and deportees – these women fought against persecution for freedom and survival amid the turbulence of World War II.","Mothers, nurses, soldiers and deportees – these women fought against persecution for freedom and survival amid the turbulence of World War II. Documentaries, International Movies",0
s3245,Movie,Shelby American,"Nate Adams, Adam Carolla",Carroll Shelby,United States,"November 22, 2019",2019,TV-MA,119 min,"Documentaries, Sports Movies","Featuring interviews and vintage footage, this documentary traces American icon Carroll Shelby's life of reinvention from farmer to racer to entrepreneur.","Featuring interviews and vintage footage, this documentary traces American icon Carroll Shelby's life of reinvention from farmer to racer to entrepreneur. Documentaries, Sports Movies",0
s8640,Movie,Tukaram,Chandrakant Kulkarni,"Jitendra Joshi, Prateeksha Lonkar, Sharad Ponkshe, Radhika Apte, Veena Jamkar, Yatin Karyekar, Smita Tambe, Vrishasen Dabholkar",India,"February 15, 2018",2012,TV-PG,162 min,"Dramas, Faith & Spirituality, International Movies",A child whose innocence and devotion set him apart from the other children of his village grows up to be one of the foremost saints of India.,"A child whose innocence and devotion set him apart from the other children of his village grows up to be one of the foremost saints of India. Dramas, Faith & Spirituality, International Movies",0
s3093,TV Show,Kevin Hart: Don’t F**k This Up,,,United States,"December 27, 2019",2019,TV-MA,1 Season,Docuseries,"Amid turmoil in his career and marriage, comedian and film star Kevin Hart opens up about his personal breakthroughs as he navigates crises and fame.","Amid turmoil in his career and marriage, comedian and film star Kevin Hart opens up about his personal breakthroughs as he navigates crises and fame. Docuseries",1
s2997,Movie,Alex Fernández: The Best Comedian in the World,Alex Díaz,Alex Fernández,Mexico,"January 23, 2020",2020,TV-MA,51 min,Stand-Up Comedy,Comic Alex Fernández performs his familiar autobiographical stories but goes a little deeper this time with a tender tale about one of his six siblings.,Comic Alex Fernández performs his familiar autobiographical stories but goes a little deeper this time with a tender tale about one of his six siblings. Stand-Up Comedy,2
s605,Movie,The Life of David Gale,Alan Parker,"Kevin Spacey, Kate Winslet, Laura Linney, Gabriel Mann, Leon Rippy, Matt Craven, Rhona Mitra, Melissa McCarthy, Jim Beaver, Chris Warner","United Kingdom, Germany, Spain, United States","July 1, 2021",2003,R,130 min,Dramas,"When a Texas professor and advocate for the elimination of the death penalty is falsely accused of a crime, he ends up on death row himself.","When a Texas professor and advocate for the elimination of the death penalty is falsely accused of a crime, he ends up on death row himself. Dramas",3
s249,TV Show,The Chair,,"Sandra Oh, Jay Duplass, Holland Taylor, David Morse, Bob Balaban, Nana Mensah, Everly Carganilla",,"August 20, 2021",2021,TV-MA,1 Season,"TV Comedies, TV Dramas","At a major university, the first woman of color to become chair tries to meet the dizzying demands and high expectations of a failing English department.","At a major university, the first woman of color to become chair tries to meet the dizzying demands and high expectations of a failing English department. TV Comedies, TV Dramas",1
s7414,Movie,Martyrs of Marriage,Deepika Narayan Bhardwaj,,India,"March 15, 2018",2016,TV-14,83 min,"Documentaries, International Movies",This documentary reveals the cracks in India's anti-dowry act and gives voice to both women and men who've been victimized by the law's abusers.,"This documentary reveals the cracks in India's anti-dowry act and gives voice to both women and men who've been victimized by the law's abusers. Documentaries, International Movies",0
s4030,TV Show,Bangkok Love Stories: Hey You!,,"Wanida Termthanaporn, Isariya Patharamanop, Nontanun Anchuleepradit, Chonnikan Netjui, Attharut Krongrasri, Sumet Ong-Art, Penpak Sirikul, Suppakorn Chaiyo, Thawat Pornrattanaprasert, M.L. Kwantip Devakula, Yingsak Chonglertjetsadawong, Apichet Atirattana, Rika Ishige",,"March 8, 2019",2018,TV-14,1 Season,"International TV Shows, Romantic TV Shows, TV Dramas",A loving couple become rivals when Belle opens a fusion bistro next to her ex-boyfriend Kram’s traditional restaurant in Bangkok’s chic Ari district.,"A loving couple become rivals when Belle opens a fusion bistro next to her ex-boyfriend Kram’s traditional restaurant in Bangkok’s chic Ari district. International TV Shows, Romantic TV Shows, TV Dramas",3
s1733,Movie,Alone/Together,Antoinette Jadaone,"Liza Soberano, Enrique Gil, Adrian Alandy, Jasmine Curtis-Smith, Sylvia Sanchez, Nonie Buencamino, Xia Vigor, Richard Manabat",Philippines,"November 5, 2020",2019,TV-14,103 min,"Dramas, International Movies, Romantic Movies","Eight years after their breakup, college sweethearts Christine and Raf reconnect at different points in their lives as feelings from the past resurface.","Eight years after their breakup, college sweethearts Christine and Raf reconnect at different points in their lives as feelings from the past resurface. Dramas, International Movies, Romantic Movies",0
s2821,Movie,Justine,Stephanie Turner,"Stephanie Turner, Glynn Turman, Daisy Prescott, Darby Stanchfield, Josh Stamberg, Bridget Kallal, Ravi Cabot-Conyers, Cleo King, Melanie Hutsell",United States,"March 13, 2020",2019,TV-MA,106 min,"Dramas, Independent Movies","A widowed, single mom takes a job caring for a young girl with spina bifida, and the two discover they have more in common than they realized.","A widowed, single mom takes a job caring for a young girl with spina bifida, and the two discover they have more in common than they realized. Dramas, Independent Movies",0
s264,TV Show,Mother Goose Club,,,United States,"August 16, 2021",2016,TV-Y,2 Seasons,Kids' TV,Classic nursery rhymes and children's songs get a fresh twist in this high-energy program that helps kids learn as they dance and sing along.,Classic nursery rhymes and children's songs get a fresh twist in this high-energy program that helps kids learn as they dance and sing along. Kids' TV,1
s248,Movie,Sweet Girl,Brian Andrew Mendoza,"Jason Momoa, Isabela Merced, Manuel Garcia-Rulfo, Amy Brenneman, Adria Arjona, Raza Jaffrey, Justin Bartha, Lex Scott Davis, Michael Raymond-James",United States,"August 20, 2021",2021,R,110 min,"Action & Adventure, Dramas","He lost the love of his life to a pharmaceutical company's greed. Now his daughter is without a mother, and he's without justice. For now.","He lost the love of his life to a pharmaceutical company's greed. Now his daughter is without a mother, and he's without justice. For now. Action & Adventure, Dramas",0
s448,Movie,The Twilight Saga: Breaking Dawn: Part 1,Bill Condon,"Kristen Stewart, Robert Pattinson, Taylor Lautner, Billy Burke, Peter Facinelli, Elizabeth Reaser, Kellan Lutz, Nikki Reed, Jackson Rathbone, Ashley Greene",United States,"July 16, 2021",2011,PG-13,117 min,"Dramas, Romantic Movies","After a dream wedding, Bella and Edward enter a new nightmare when a shocking development forces life-or-death decisions.","After a dream wedding, Bella and Edward enter a new nightmare when a shocking development forces life-or-death decisions. Dramas, Romantic Movies",0
s4116,Movie,"Ken Jeong: You Complete Me, Ho",Jon M. Chu,Ken Jeong,United States,"February 14, 2019",2019,TV-MA,62 min,Stand-Up Comedy,"In his first-ever stand-up special, Ken Jeong pays tribute to his wife and shares stories about Hollywood and how ""The Hangover"" saved his life.","In his first-ever stand-up special, Ken Jeong pays tribute to his wife and shares stories about Hollywood and how ""The Hangover"" saved his life. Stand-Up Comedy",2
s200,Movie,Koi Aap Sa,Partho Mitra,"Aftab Shivdasani, Natassha, Dipannita Sharma, Himanshu Mallik, Vaidya Advai, Pushy Anand, Shama Deshpande, Rajendra Gupta",India,"August 27, 2021",2006,TV-14,135 min,"Comedies, Dramas, International Movies","Star athlete Rohan has his eye on a beautiful art student. But when his best friend Simran experiences a crisis, he drops everything to help her.","Star athlete Rohan has his eye on a beautiful art student. But when his best friend Simran experiences a crisis, he drops everything to help her. Comedies, Dramas, International Movies",0
s533,TV Show,Scream,,"Willa Fitzgerald, Bex Taylor-Klaus, John Karna, Amadeus Serafini, Connor Weil, Carlson Young, Jason Wiles, Tracy Middendorf, Tom Maden, Bobby Campo, Santiago Segura, Mike Vaughn",United States,"July 6, 2021",2019,TV-MA,3 Seasons,"Crime TV Shows, TV Horror, TV Mysteries","In this new TV series sequel to the classic horror franchise, a cyberbullying incident in Lakewood leads to a murder with chilling echoes of the past.","In this new TV series sequel to the classic horror franchise, a cyberbullying incident in Lakewood leads to a murder with chilling echoes of the past. Crime TV Shows, TV Horror, TV Mysteries",3
s2888,Movie,Full Count,Robert Eagar,"John Paul Kakos, Natalia Livingston, E. Roger Mitchell, Rick Hearst, Jason London, Victoria Elizabeth Staley, Adam Boyer",United States,"February 23, 2020",2019,TV-PG,110 min,"Children & Family Movies, Dramas, Faith & Spirituality","When tragic events force an aspiring baseball player to forgo his big league dreams and return home, saving the family farm grants him renewed purpose.","When tragic events force an aspiring baseball player to forgo his big league dreams and return home, saving the family farm grants him renewed purpose. Children & Family Movies, Dramas, Faith & Spirituality",0
s2303,Movie,Thiago Ventura: POKAS,"Fabio Ock, Joana Mazzucchelli",Thiago Ventura,Brazil,"July 2, 2020",2020,TV-MA,82 min,Stand-Up Comedy,"In a rollicking special, Thiago Ventura jokes about life in the hood, social issues and more, explaining how actions speak louder than words.","In a rollicking special, Thiago Ventura jokes about life in the hood, social issues and more, explaining how actions speak louder than words. Stand-Up Comedy",2
s4701,Movie,Bhavesh Joshi Superhero,Vikramaditya Motwane,"Harshvardhan Kapoor, Priyanshu Painyuli, Ashish Verma, Shreiya Sabharwal, Pratap Phad, Chinmayee Mandlekar, Nishikant Kamat, Hrishikesh Joshi",India,"August 16, 2018",2018,TV-14,150 min,"Dramas, International Movies, Sci-Fi & Fantasy","When his best friend is killed for uncovering political corruption, an idealistic young man decides to become a masked fighter for justice.","When his best friend is killed for uncovering political corruption, an idealistic young man decides to become a masked fighter for justice. Dramas, International Movies, Sci-Fi & Fantasy",0
s4692,Movie,Mersal,Atlee Kumar,"Joseph Vijay, S.J. Surya, Kajal Aggarwal, Samantha Ruth Prabhu, Nithya Menon, Vadivelu, Sathyaraj",India,"August 21, 2018",2017,TV-14,162 min,"Action & Adventure, Dramas, International Movies","A detective arrests a doctor for crimes targeting medical professionals but later finds the real culprit in a tale of revenge, corruption and magic.","A detective arrests a doctor for crimes targeting medical professionals but later finds the real culprit in a tale of revenge, corruption and magic. Action & Adventure, Dramas, International Movies",0
s456,Movie,Emicida: AmarElo - Live in São Paulo,Fred Ouro Preto,Emicida,,"July 15, 2021",2021,TV-MA,100 min,"Documentaries, International Movies, Music & Musicals","Brazilian rapper Emicida brings his progressive rhymes and eclectic beats to São Paulo's Theatro Municipal as he performs hits from the album ""AmarElo.""","Brazilian rapper Emicida brings his progressive rhymes and eclectic beats to São Paulo's Theatro Municipal as he performs hits from the album ""AmarElo."" Documentaries, International Movies, Music & Musicals",0
s7397,Movie,Mango Dreams,John Upchurch,"Ram Gopal Bajaj, Pankaj Tripathi, Sameer Kochhar",United States,"March 15, 2018",2016,TV-14,92 min,"Dramas, Independent Movies","Concerned that dementia will soon steal his most cherished memories, a Hindu doctor hires a Mulsim rickshaw driver to take him to his childhood home.","Concerned that dementia will soon steal his most cherished memories, a Hindu doctor hires a Mulsim rickshaw driver to take him to his childhood home. Dramas, Independent Movies",0
s5333,Movie,Demonic,Will Canon,"Maria Bello, Frank Grillo, Cody Horn, Dustin Milligan, Megan Park, Scott Mechlowicz, Aaron Yoo, Alex Goode, Terence Rosemore, Jesse Steccato",United States,"August 10, 2017",2015,R,83 min,"Horror Movies, Independent Movies","When amateur ghost hunters visit an abandoned house, their investigation turns into a massacre, leaving questions for a detective and a psychologist.","When amateur ghost hunters visit an abandoned house, their investigation turns into a massacre, leaving questions for a detective and a psychologist. Horror Movies, Independent Movies",0
s7721,Movie,Pee Mak,Banjong Pisanthanakun,"Mario Maurer, Davika Hoorne, Nattapong Chartpong, Pongsatorn Jongwilak, Wiwat Kongrasri, Kantapat Permpoonpatcharasuk, Sean Jindachot",Thailand,"September 1, 2018",2013,TV-MA,112 min,"Comedies, Horror Movies, International Movies","Mak's friends just want to protect him, but his wife Nak won't let a small thing like her own death get in the way of true love in this horror-comedy.","Mak's friends just want to protect him, but his wife Nak won't let a small thing like her own death get in the way of true love in this horror-comedy. Comedies, Horror Movies, International Movies",0
s1427,Movie,Gangaajal,Prakash Jha,"Ajay Devgn, Gracy Singh, Mohan Agashe, Mohan Joshi, Ayub Khan, Akhilendra Mishra, Mukesh Tiwari, Yashpal Sharma, Brij Gopal, Anita Kanwal",India,"January 8, 2021",2003,TV-MA,148 min,"Dramas, International Movies","Posted to a small, crime-ridden town, a cop soon learns that cleaning up the system also means confronting the corruption among police and politicians.","Posted to a small, crime-ridden town, a cop soon learns that cleaning up the system also means confronting the corruption among police and politicians. Dramas, International Movies",0
s1430,TV Show,Mighty Little Bheem: Kite Festival,,"Sumruddhi Shukla, Aranya Kaur, Nishka Raheja",India,"January 8, 2021",2021,TV-Y,1 Season,"Kids' TV, TV Comedies","With winter behind them, Bheem and his townspeople usher in a sunny new season in all their favorite ways during the Makar Sankranti festival.","With winter behind them, Bheem and his townspeople usher in a sunny new season in all their favorite ways during the Makar Sankranti festival. Kids' TV, TV Comedies",1
s7648,Movie,Oklahoma City,Barak Goodman,,United States,"April 19, 2017",2017,TV-14,102 min,Documentaries,Domestic terrorist Timothy McVeigh's bomb attack on an Oklahoma City federal building in 1995 is chronicled in this examination of the shocking event.,Domestic terrorist Timothy McVeigh's bomb attack on an Oklahoma City federal building in 1995 is chronicled in this examination of the shocking event. Documentaries,0
s4774,Movie,How It Ends,David M. Rosenthal,"Theo James, Forest Whitaker, Kat Graham, Nicole Ari Parker, Mark O'Brien, Grace Dove",United States,"July 13, 2018",2018,TV-MA,113 min,"Action & Adventure, Sci-Fi & Fantasy","When a mysterious disaster turns the country into a war zone, a young lawyer heads west with his future father-in-law to find his pregnant fiancée.","When a mysterious disaster turns the country into a war zone, a young lawyer heads west with his future father-in-law to find his pregnant fiancée. Action & Adventure, Sci-Fi & Fantasy",4
s1942,Movie,Ishq Vishk,Ken Ghosh,"Shahid Kapoor, Amrita Rao, Shenaz Treasury, Vishal Malhotra, Kapil Jhaveri, Shabhir, Deepti Gujral, Yash Tonk, Satish Shah, Neelima Azim",India,"September 28, 2020",2003,TV-PG,129 min,"Comedies, International Movies, Music & Musicals","When the duplicitous Rajiv expresses his love for Payal, a cruel lie kicks off a story of self-discovery and unexpected romance.","When the duplicitous Rajiv expresses his love for Payal, a cruel lie kicks off a story of self-discovery and unexpected romance. Comedies, International Movies, Music & Musicals",0
s8528,Movie,The Texas Chainsaw Massacre,Tobe Hooper,"Gunnar Hansen, Jim Siedow, Marilyn Burns, Edwin Neal, Paul A. Partain, Teri McMinn, William Vail, John Dugan, John Henry Faulk, Allen Danziger",United States,"October 22, 2019",1974,R,83 min,"Cult Movies, Horror Movies, Independent Movies","When some friends visit a vandalized graveyard, they come upon a chainsaw-wielding maniac, and it's a fight to the bloody death between good and evil.","When some friends visit a vandalized graveyard, they come upon a chainsaw-wielding maniac, and it's a fight to the bloody death between good and evil. Cult Movies, Horror Movies, Independent Movies",0
s2861,Movie,Hugo,Martin Scorsese,"Ben Kingsley, Sacha Baron Cohen, Asa Butterfield, Chloë Grace Moretz, Ray Winstone, Emily Mortimer, Christopher Lee, Helen McCrory, Michael Stuhlbarg, Frances de la Tour, Jude Law, Johnny Depp, Edmund Kingsley, Richard Griffiths, Angus Barnett, Michael Pitt, Gulliver McGrath, Eric Moreau, Chloe Grace Moretz","United Kingdom, United States, France","March 1, 2020",2011,PG,127 min,"Children & Family Movies, Dramas","Living inside a Paris train station, an orphan eludes the rigid stationmaster, meets a legendary filmmaker and finds the key to unlocking his destiny.","Living inside a Paris train station, an orphan eludes the rigid stationmaster, meets a legendary filmmaker and finds the key to unlocking his destiny. Children & Family Movies, Dramas",0
s4129,Movie,"Ray Romano: Right Here, Around the Corner",Michael Showalter,Ray Romano,United States,"February 5, 2019",2019,TV-MA,59 min,Stand-Up Comedy,"Ray Romano cut his stand-up teeth at the Comedy Cellar in New York. Now, in his first comedy special in 23 years, he returns to where it all began.","Ray Romano cut his stand-up teeth at the Comedy Cellar in New York. Now, in his first comedy special in 23 years, he returns to where it all began. Stand-Up Comedy",2
s4451,Movie,Marc Maron: Thinky Pain,Lance Bangs,Marc Maron,United States,"November 1, 2018",2013,TV-MA,95 min,Stand-Up Comedy,"Alternative comic Marc Maron is back on stage in New York to talk Chinese food, drug abuse, sex in hotel rooms and life with his girlfriend.","Alternative comic Marc Maron is back on stage in New York to talk Chinese food, drug abuse, sex in hotel rooms and life with his girlfriend. Stand-Up Comedy",2
s7773,TV Show,Power Rangers S.P.D.,,"Brandon Jay McLaren, Chris Violette, Matt Austin, Monica May, Alycia Purrott, John Tui, Rene Naufahu, Michelle Langstone, Barnie Duncan, Kelson Henderson, Jim McLarty, Olivia James-Baird, Josephine Davison, Derek Judge, James Gaylyn","United States, New Zealand","January 1, 2016",2005,TV-Y7,1 Season,Kids' TV,"When the Troobian Empire attacks Earth, the B-Squad Power Rangers Space Patrol Delta morphs into action to squash the alien threat and save the world.","When the Troobian Empire attacks Earth, the B-Squad Power Rangers Space Patrol Delta morphs into action to squash the alien threat and save the world. Kids' TV",1
