show_id,type,title,director,cast,country,date_added,release_year,rating,duration,listed_in,description,combined_text,cluster
s4971,Movie,"Game Over, Man!",Kyle Newacheck,"Adam DeVine, Anders Holm, Blake Anderson, Utkarsh Ambudkar, Aya Cash, Neal McDonough, Daniel Stern, Jamie Demetriou, Rhona Mitra, Sam Richardson, Steve Howey, Mac Brandt, Geno Segers, Roe Hartrampf",United States,"March 23, 2018",2018,TV-MA,102 min,"Action & Adventure, Comedies",Three buddies with big dreams go from underachieving slackers to badass warriors when their posh hotel is taken over by terrorists.,"Three buddies with big dreams go from underachieving slackers to badass warriors when their posh hotel is taken over by terrorists. Action & Adventure, Comedies",0
s3363,Movie,Arsenio Hall: Smart & Classy,Brian Volk-Weiss,Arsenio Hall,United States,"October 29, 2019",2019,TV-MA,63 min,Stand-Up Comedy,"In his first stand-up special, Arsenio Hall discusses getting older, the changing times and culture, social issues and even bothersome baby toes.","In his first stand-up special, Arsenio Hall discusses getting older, the changing times and culture, social issues and even bothersome baby toes. Stand-Up Comedy",2
s5495,TV Show,Kazoops!,,"Reece Pockney, Scott Langley, Alex Babic, Gemma Harvey, Jessica Hann, Emma Tate",Australia,"May 5, 2017",2017,TV-Y,3 Seasons,Kids' TV,Music meets imagination in this inventive animated series about thinking outside the box and having fun.,Music meets imagination in this inventive animated series about thinking outside the box and having fun. Kids' TV,1
s1689,TV Show,We Are the Champions,,,United States,"November 17, 2020",2020,TV-MA,1 Season,"Docuseries, Reality TV","Explore an array of unique competitions, from the quirky to the bizarre, and meet their passionate communities in this docuseries.","Explore an array of unique competitions, from the quirky to the bizarre, and meet their passionate communities in this docuseries. Docuseries, Reality TV",1
s1350,TV Show,"Pablo Escobar, el patrón del mal",,"Andrés Parra, Angie Cepeda, Cecilia Navia, Vicky Hernández, Christian Tappan, Rodolfo Silva, Tommy Vásquez, Toto Vega, Nicolás Montero, Marcela Gallego",Colombia,"February 3, 2021",2012,TV-MA,1 Season,"Crime TV Shows, International TV Shows, Spanish-Language TV Shows","From his days as a petty thief to becoming head of a drug-trafficking empire, this riveting series charts the life of the infamous Pablo Escobar.","From his days as a petty thief to becoming head of a drug-trafficking empire, this riveting series charts the life of the infamous Pablo Escobar. Crime TV Shows, International TV Shows, Spanish-Language TV Shows",3
s4863,TV Show,Saint Seiya: The Lost Canvas,,"Tetsuya Kakihara, Hiro Shimono, Aya Hirano, Atsushi Abe, Sanae Kobayashi, Kenta Miyake, Tomohiro Tsuboi, Nana Mizuki, Shigeru Chiba",Japan,"May 15, 2018",2009,TV-MA,1 Season,"Anime Series, International TV Shows",This anime adventure follows the battle between a saint of Athena and an avatar of Hades who's working on a painting that could destroy the world.,"This anime adventure follows the battle between a saint of Athena and an avatar of Hades who's working on a painting that could destroy the world. Anime Series, International TV Shows",1
s2677,TV Show,Fauda,,"Lior Raz, Hisham Suliman, Shadi Mar'i, Laëtitia Eïdo, Tsahi Halevi, Yuval Segal, Neta Garty, Tomer Kapon, Itzik Cohen, Rona-Lee Shim'on, Boaz Konforty, Doron Ben-David",Israel,"April 16, 2020",2020,TV-MA,3 Seasons,"Crime TV Shows, International TV Shows, TV Action & Adventure","A top Israeli agent comes out of retirement to hunt for a Palestinian militant he thought he'd killed, setting a chaotic chain of events into motion.","A top Israeli agent comes out of retirement to hunt for a Palestinian militant he thought he'd killed, setting a chaotic chain of events into motion. Crime TV Shows, International TV Shows, TV Action & Adventure",3
s488,TV Show,The Cook of Castamar,,"Michelle Jenner, Roberto Enríquez, Hugo Silva, Maxi Iglesias, María Hervás, Agnès Llobet, Paula Usero, Jean Cruz, Óscar Rabadán, Fiorella Faltoyano, Nancho Novo, Silvia Abascal, Mónica López",,"July 9, 2021",2021,TV-MA,1 Season,"International TV Shows, Romantic TV Shows, Spanish-Language TV Shows","In 1720 Madrid, a talented cook catches the eye of a widowed duke just as he returns to aristocratic society. Based on the novel by Fernando J. Múñez.","In 1720 Madrid, a talented cook catches the eye of a widowed duke just as he returns to aristocratic society. Based on the novel by Fernando J. Múñez. International TV Shows, Romantic TV Shows, Spanish-Language TV Shows",3
s1672,Movie,The App That Stole Christmas,Monica Floyd,"Jackie Long, Diane Marie Howard, Jaylin Hall, Miguel A. Núñez Jr., Ray J, JayQ The Legend, J. Anthony Brown, Kenny Rhodes, Amber Cosich",United States,"November 20, 2020",2020,TV-PG,64 min,"Children & Family Movies, Comedies","A tech entrepreneur's Christmas shopping app is a smashing success, but he starts to realize his invention might be ruining the holiday spirit.","A tech entrepreneur's Christmas shopping app is a smashing success, but he starts to realize his invention might be ruining the holiday spirit. Children & Family Movies, Comedies",0
s5029,Movie,Mute,Duncan Jones,"Alexander Skarsgård, Paul Rudd, Justin Theroux","United Kingdom, Germany","February 23, 2018",2018,TV-MA,127 min,"Sci-Fi & Fantasy, Thrillers","When his girlfriend vanishes, a mute man ventures into a near-future Berlin's seamy underworld, where his actions speak louder than words.","When his girlfriend vanishes, a mute man ventures into a near-future Berlin's seamy underworld, where his actions speak louder than words. Sci-Fi & Fantasy, Thrillers",4
s6652,TV Show,"Drugs, Inc.",,Mike Secher,United States,"March 23, 2019",2015,TV-MA,1 Season,"Crime TV Shows, Docuseries","This absorbing documentary series follows the entire supply chain of the illicit drug trade, tracing its production, export, sale and consumption.","This absorbing documentary series follows the entire supply chain of the illicit drug trade, tracing its production, export, sale and consumption. Crime TV Shows, Docuseries",3
s6593,Movie,Den of Thieves,Christian Gudegast,"Gerard Butler, Pablo Schreiber, O'Shea Jackson Jr., 50 Cent, Meadow Williams, Maurice Compte, Brian Van Holt, Evan Jones, Mo McRae, Kaiwi Lyman",United States,"May 1, 2020",2018,R,140 min,Action & Adventure,A highly skilled crew of bank robbers plotting a heist at the supposedly impenetrable Federal Reserve faces off against an elite unit of L.A. cops.,A highly skilled crew of bank robbers plotting a heist at the supposedly impenetrable Federal Reserve faces off against an elite unit of L.A. cops. Action & Adventure,0
s8464,Movie,The President's Barber,Chan-sang Lim,"Kang-ho Song, So-ri Moon, Jae-eung Lee, Yeong-jin Jo, Byung-ho Son, Yong-soo park, Seung-soo Ryu, Ju-sang Yun, Gyu-su Jeong, Dal-su Oh",South Korea,"October 1, 2017",2004,TV-MA,116 min,"Comedies, Dramas, International Movies","The personal barber to the president, as well as his wife and only son, get tangled in the political chaos that gripped South Korea in the late 1900s.","The personal barber to the president, as well as his wife and only son, get tangled in the political chaos that gripped South Korea in the late 1900s. Comedies, Dramas, International Movies",0
s3986,Movie,The Dirt,Jeff Tremaine,"Douglas Booth, Iwan Rheon, Colson Baker, Daniel Webber, David Costabile, Pete Davidson",United States,"March 22, 2019",2019,TV-MA,108 min,"Comedies, Dramas, Music & Musicals","In this unflinching biopic based on Mötley Crüe's best-selling book, four LA misfits navigate the monster highs and savage lows of music superstardom.","In this unflinching biopic based on Mötley Crüe's best-selling book, four LA misfits navigate the monster highs and savage lows of music superstardom. Comedies, Dramas, Music & Musicals",0
s2692,TV Show,Brews Brothers,,"Alan Aisenberg, Mike Castle, Carmen Flood, Marques Ray",United States,"April 10, 2020",2020,TV-MA,1 Season,TV Comedies,"Two rival brothers must work together to keep their brewery in business, but shenanigans keep foaming up their company with chaos.","Two rival brothers must work together to keep their brewery in business, but shenanigans keep foaming up their company with chaos. TV Comedies",0
s5235,Movie,Rodney Carrington: Here Comes the Truth,Brandon Jones,Rodney Carrington,United States,"October 3, 2017",2017,TV-MA,66 min,Stand-Up Comedy,"Raunchy country comic and musician Rodney Carrington jokes and sings about life in his 40s, poking fun at sex, relationships and gaining weight.","Raunchy country comic and musician Rodney Carrington jokes and sings about life in his 40s, poking fun at sex, relationships and gaining weight. Stand-Up Comedy",2
s7750,Movie,Planet Hulk,Sam Liu,"Rick D. Wasserman, Lisa Ann Beley, Mark Hildreth, Liam O'Brien, Kevin Michael Richardson, Sam Vincent, Advah Soudack, Michael Kopsa, Paul Dobson, Marc Worden",United States,"June 1, 2020",2010,TV-14,81 min,"Action & Adventure, Sci-Fi & Fantasy","When Earth's superheroes exile the volatile Incredible Hulk to a distant planet called Sakaar, the muscle-bound green monster is sold into slavery.","When Earth's superheroes exile the volatile Incredible Hulk to a distant planet called Sakaar, the muscle-bound green monster is sold into slavery. Action & Adventure, Sci-Fi & Fantasy",4
s8621,Movie,Tree Man,"Jon Reiner, Brad Rothschild",,Canada,"November 1, 2016",2015,TV-PG,82 min,Documentaries,"Entrepreneurs from Vermont and Quebec sell Christmas trees on the streets of New York, becoming a cherished part of neighborhood holiday traditions.","Entrepreneurs from Vermont and Quebec sell Christmas trees on the streets of New York, becoming a cherished part of neighborhood holiday traditions. Documentaries",0
s4996,Movie,Ladies First,Uraaz Bahl,,India,"March 8, 2018",2018,TV-G,40 min,"Documentaries, International Movies, Sports Movies","Born amid poverty and limited women's rights in the village of Ratu, India, Deepika Kumari rose to become the No.1 female archer in the world at 18.","Born amid poverty and limited women's rights in the village of Ratu, India, Deepika Kumari rose to become the No.1 female archer in the world at 18. Documentaries, International Movies, Sports Movies",0
s7208,Movie,King Jack,Felix Thompson,"Charlie Plummer, Cory Nichols, Christian Madsen, Danny Flaherty, Erin Davie, Chloe Levine",United States,"July 1, 2016",2015,NR,81 min,"Dramas, Independent Movies","Already coping with a bully, a mercurial older brother and summer school, 15-year-old Jack is saddled with his young cousin for an eventful weekend.","Already coping with a bully, a mercurial older brother and summer school, 15-year-old Jack is saddled with his young cousin for an eventful weekend. Dramas, Independent Movies",0
s2522,Movie,"I love you, stupid",Laura Mañá,"Quim Gutiérrez, Natalia Tena, Alfonso Bassave, Alba Ribas, Patricia Vico, Ernesto Alterio",Spain,"May 15, 2020",2019,TV-MA,88 min,"Comedies, International Movies, Romantic Movies","After Marcos is dumped by his girlfriend, he attempts to reinvent himself as a modern man with the help of a childhood friend and an online guru.","After Marcos is dumped by his girlfriend, he attempts to reinvent himself as a modern man with the help of a childhood friend and an online guru. Comedies, International Movies, Romantic Movies",0
s6035,Movie,A Family Man,Mark Williams,"Gerard Butler, Gretchen Mol, Alison Brie, Willem Dafoe, Alfred Molina, Maxwell Jenkins, Anupam Kher, Dustin Milligan","Canada, United States","December 15, 2019",2016,R,110 min,Dramas,A ruthless corporate headhunter battles his rival for a promotion while dealing with a family crisis that threatens to derail his career.,A ruthless corporate headhunter battles his rival for a promotion while dealing with a family crisis that threatens to derail his career. Dramas,1
s240,Movie,Boomika (Telugu),Rathindran R Prasad,"Aishwarya Rajesh, Vidhu, Surya Ganapathy, Madhuri, Pavel Navageethan, Avantika Vandanapu",,"August 23, 2021",2021,TV-14,122 min,"Horror Movies, International Movies, Thrillers","Paranormal activity at a lush, abandoned property alarms a group eager to redevelop the site, but the eerie events may not be as unearthly as they think.","Paranormal activity at a lush, abandoned property alarms a group eager to redevelop the site, but the eerie events may not be as unearthly as they think. Horror Movies, International Movies, Thrillers",0
s5665,Movie,3 Türken & ein Baby,Sinan Akkuş,"Kostja Ullmann, Eko Fresh, Kida Khodr Ramadan, Sabrina Klüber, Sami Nasser, Kayla Rybicka, Jytte-Merle Böhrnsen, Emrah Erdogru, Tim Grothe, Hülya Duyar",Germany,"December 15, 2016",2015,TV-MA,93 min,"Comedies, International Movies",The lives of three dissatisfied brothers running a family bridal shop turn topsy-turvy when one of them has to care for his ex-girlfriend's baby.,"The lives of three dissatisfied brothers running a family bridal shop turn topsy-turvy when one of them has to care for his ex-girlfriend's baby. Comedies, International Movies",0
s2134,TV Show,Teenage Bounty Hunters,,"Anjelica Bette Fellini, Maddie Phillips, Kadeem Hardison, Virginia Williams, Mackenzie Astin, Shirley Rumierk, Myles Evans, Devon Hales, Spencer House, Eric Graise, Charity Cervantes, Wynn Everett, Method Man",United States,"August 14, 2020",2020,TV-MA,1 Season,"Crime TV Shows, TV Comedies, TV Dramas",Twin sisters Sterling and Blair balance teen life at an elite Southern high school with an unlikely new career as butt-kicking bounty hunters.,"Twin sisters Sterling and Blair balance teen life at an elite Southern high school with an unlikely new career as butt-kicking bounty hunters. Crime TV Shows, TV Comedies, TV Dramas",1
s7051,TV Show,I'm Sorry,,"Andrea Savage, Tom Everett Scott, Olive Petrucci",United States,"September 13, 2019",2019,TV-MA,2 Seasons,TV Comedies,"Life is a series of awkward situations for comedy writer and mom Andrea, thanks to plenty of neuroses and a knack for sticking her foot in her mouth.","Life is a series of awkward situations for comedy writer and mom Andrea, thanks to plenty of neuroses and a knack for sticking her foot in her mouth. TV Comedies",1
s8148,TV Show,Taken,,"Clive Standen, Jennifer Beals, Gaius Charles, Brooklyn Sudano, Monique Gabriela Curnen, Michael Irby, James Landry Hébert, Jose Pablo Cantillo, James Landry Hebert","France, United States"," January 12, 2019",2018,TV-14,2 Seasons,"Crime TV Shows, TV Action & Adventure, TV Thrillers","After a personal tragedy upends his life, a highly skilled former Green Beret is drawn into a career as a secret government operative.","After a personal tragedy upends his life, a highly skilled former Green Beret is drawn into a career as a secret government operative. Crime TV Shows, TV Action & Adventure, TV Thrillers",1
s6932,Movie,Harriet the Spy: Blog Wars,Ron Oliver,"Jennifer Stone, Kristin Booth, Wesley Morgan, Doug Murray, Shauna MacDonald, Jason Blicker, Jayne Eastwood, Melinda Shankar, Alexander Conti, Vanessa Morgan","United States, Canada","April 15, 2018",2010,TV-G,87 min,"Children & Family Movies, Comedies",Intrepid writer Harriet Welsch is determined to become the class blogger despite stiff competition from her snooty archrival.,"Intrepid writer Harriet Welsch is determined to become the class blogger despite stiff competition from her snooty archrival. Children & Family Movies, Comedies",0
s7118,Movie,Jal,Girish Malik,"Purab Kohli, Tannishtha Chatterjee, Kirti Kulhari, Yashpal Sharma, Mukul Dev, Saidah Jules, Ravi Gossain, Rahul Singh",India,"October 15, 2017",2013,TV-14,132 min,"Dramas, Independent Movies, International Movies",A gifted young man from a drought-stricken village helps a group of ecologists find water for migrating flamingoes.,"A gifted young man from a drought-stricken village helps a group of ecologists find water for migrating flamingoes. Dramas, Independent Movies, International Movies",0
s1047,Movie,Only Mine,Michael Civille,"Amber Midthunder, Brett Zimmerman, Chris Browning, Walter Fauntleroy, Claudia Ferri, Lorenzo James Henrie, Ellen Wroe, Ashley Holliday Tavares, Nancy Linehan Charles, Jonna Walsh",United States,"April 15, 2021",2019,TV-14,88 min,Thrillers,"After dating a charming cop who turns into an obsessive stalker, a small-town girl must save herself from his deadly ways.","After dating a charming cop who turns into an obsessive stalker, a small-town girl must save herself from his deadly ways. Thrillers",0
s5107,Movie,Bibi & Tina: Tohuwabohu Total,Detlev Buck,"Lina Larissa Strahl, Lisa-Marie Koroll, Louis Held, Lea van Acken, Emilio Sakraya, Michael Maertens, Martin Seifert",Germany,"December 27, 2017",2017,TV-14,106 min,"Children & Family Movies, Music & Musicals",Teen witch Bibi and her pal Tina return to the screen to reconcile a runaway girl with her narrow-minded family and save Falkenstein Castle from chaos.,"Teen witch Bibi and her pal Tina return to the screen to reconcile a runaway girl with her narrow-minded family and save Falkenstein Castle from chaos. Children & Family Movies, Music & Musicals",0
s6568,Movie,Darna Mana Hai,Prawal Raman,"Aftab Shivdasani, Antara Mali, Boman Irani, Isha Koppikar, Nana Patekar, Raghuvir Yadav, Rajpal Yadav, Revathy, Saif Ali Khan, Sameera Reddy, Sanjay Kapoor, Shilpa Shetty, Sohail Khan, Vivek Oberoi",India,"August 1, 2019",2003,TV-MA,116 min,"Horror Movies, International Movies, Thrillers","Stranded in a jungle when their car breaks down, six friends pass their time exchanging horror stories, unaware that they may be part of one themselves.","Stranded in a jungle when their car breaks down, six friends pass their time exchanging horror stories, unaware that they may be part of one themselves. Horror Movies, International Movies, Thrillers",0
s5401,Movie,Professor,Lekh Tandon,"Shammi Kapoor, Kalpana, Lalita Pawar, Parveen Choudhary, Salim, Pratima Devi, Rashid Khan, Bir Sakuja, Bela Bose, Ratnamala",India,"July 1, 2017",1962,TV-PG,163 min,"Comedies, Dramas, International Movies",A college grad in need of money must disguise himself as an old man to tutor two young women who are under the watchful eye of their strict aunt.,"A college grad in need of money must disguise himself as an old man to tutor two young women who are under the watchful eye of their strict aunt. Comedies, Dramas, International Movies",0
s3071,Movie,Posesif,Edwin,"Putri Marino, Adipati Dolken, Gritte Agatha, Chicco Kurniawan, Yayu Unru, Cut Mini Theo, Ismail Basbeth, Maulidina K. Putri",Indonesia,"January 1, 2020",2017,TV-MA,102 min,"Dramas, International Movies, Romantic Movies",A student diver risks her scholastic future and relationship with her father when she dates a moody transfer student consumed by their romance.,"A student diver risks her scholastic future and relationship with her father when she dates a moody transfer student consumed by their romance. Dramas, International Movies, Romantic Movies",0
s8409,Movie,The lynx,Stanisław Różewicz,"Jerzy Radziwiłowicz, Franciszek Pieczka, Piotr Bajor, Ryszarda Hanin, Janusz Paluszkiewicz, Henryk Machalica, Hanna Mikuć, Maria Klejdysz",Poland,"October 1, 2019",1982,TV-14,82 min,"Dramas, International Movies",A priest's duties are tested when a young guerrilla asks for absolution while confessing his plans to murder a local man he believes is a traitor.,"A priest's duties are tested when a young guerrilla asks for absolution while confessing his plans to murder a local man he believes is a traitor. Dramas, International Movies",0
s3188,TV Show,Nightflyers,,"Eoin Macken, David Ajala, Jodie Turner-Smith, Angus Sampson, Sam Strike, Maya Eshet, Brían F. O'Byrne, Gretchen Mol, Miranda Raison",United States,"December 2, 2019",2018,TV-MA,1 Season,"TV Horror, TV Mysteries, TV Sci-Fi & Fantasy","With humankind's future at stake, a group of scientists and a powerful telepath venture into the void aboard a spaceship full of secrets.","With humankind's future at stake, a group of scientists and a powerful telepath venture into the void aboard a spaceship full of secrets. TV Horror, TV Mysteries, TV Sci-Fi & Fantasy",4
s6728,Movie,Eyyvah Eyyvah 3,Hakan Algül,"Demet Akbağ, Ata Demirer, Özge Borak, Salih Kalyon, Tanju Tuncel, Serra Yılmaz, Tarık Ünlüoğlu, Ayşenil Şamlıoğlu",Turkey,"March 10, 2017",2014,TV-PG,103 min,"Comedies, International Movies","Life is tough for Hüseyin after marrying his true love. He works day and night to support his growing family, while singer Firuzan copes with fame.","Life is tough for Hüseyin after marrying his true love. He works day and night to support his growing family, while singer Firuzan copes with fame. Comedies, International Movies",0
s6714,Movie,Everybody Knows,Asghar Farhadi,"Penélope Cruz, Javier Bardem, Ricardo Darín, Eduard Fernández, Bárbara Lennie, Inma Cuesta, Elvira Mínguez, Ramón Barea, Carla Campra, Sara Sálamo, Roger Casamajor, José Ángel Egido","Spain, France, Italy","June 6, 2019",2019,R,133 min,"Dramas, International Movies, Thrillers","Journeying back to her small Spanish hometown for her sister's wedding, Laura must grapple with long-buried secrets when her daughter is abducted.","Journeying back to her small Spanish hometown for her sister's wedding, Laura must grapple with long-buried secrets when her daughter is abducted. Dramas, International Movies, Thrillers",0
s5723,TV Show,Case,,"Steinunn Ólína Þorsteinsdóttir, Magnús Jónsson, Þorsteinn Bachmann, Jóhanna Vigdís Arnardóttir, Birna Rún Eiríksdóttir, Elma Stefania Agustsdottir, Bergur Þór Ingólfsson, Halldóra Geirharðsdóttir, Arnar Jónsson, Davíð Freyr Þórunnarson, Björn Stefánsson, Nína Dögg Filippusdóttir, Hjortur Jóhann Jónsson",Iceland,"November 9, 2016",2015,TV-MA,1 Season,"Crime TV Shows, International TV Shows, TV Dramas",A smart lawyer whose drinking and recklessness send him on a path of self-destruction finds new purpose investigating a teenager's apparent suicide.,"A smart lawyer whose drinking and recklessness send him on a path of self-destruction finds new purpose investigating a teenager's apparent suicide. Crime TV Shows, International TV Shows, TV Dramas",3
s96,TV Show,The Circle,,Michelle Buteau,"United States, United Kingdom","September 8, 2021",2021,TV-MA,3 Seasons,Reality TV,"Status and strategy collide in this social experiment and competition show where online players flirt, befriend and catfish their way toward $100,000.","Status and strategy collide in this social experiment and competition show where online players flirt, befriend and catfish their way toward $100,000. Reality TV",1
s8678,Movie,Vikings Unearthed,Harvey Lilley,Eric Meyers,United States,"March 1, 2017",2016,TV-PG,113 min,Documentaries,Archaeologist Sarah Parcak follows clues to early Viking explorations and discusses just what these notoriously fierce warriors were really like.,Archaeologist Sarah Parcak follows clues to early Viking explorations and discusses just what these notoriously fierce warriors were really like. Documentaries,0
s3788,TV Show,Bad Blood,,"Anthony LaPaglia, Kim Coates, Enrico Colantoni, Paul Sorvino, Maxim Roy, Brett Donahue, Michelle Mylett, Claudia Ferri, Tony Nappo",Canada,"May 31, 2019",2019,TV-MA,2 Seasons,"Crime TV Shows, TV Dramas","This sprawling crime drama follows the true story of the Rizzuto family and its associates, who presided over organized crime in Montreal for decades.","This sprawling crime drama follows the true story of the Rizzuto family and its associates, who presided over organized crime in Montreal for decades. Crime TV Shows, TV Dramas",3
s7536,Movie,My Entire High School Sinking Into the Sea,Dash Shaw,"Jason Schwartzman, Lena Dunham, Reggie Watts, Maya Rudolph, Susan Sarandon, Thomas Jay Ryan, Alex Karpovsky, Louisa Krause, John Cameron Mitchell, Matthew Maher",United States,"January 23, 2018",2016,PG-13,77 min,"Comedies, Independent Movies","After an earthquake sends their school building drifting into the sea, a group of high-schoolers struggles to survive and overcome clique wars.","After an earthquake sends their school building drifting into the sea, a group of high-schoolers struggles to survive and overcome clique wars. Comedies, Independent Movies",0
s222,Movie,"Bob Ross: Happy Accidents, Betrayal & Greed",Joshua Rofé,Bob Ross,,"August 25, 2021",2021,TV-14,93 min,Documentaries,Bob Ross brought joy to millions as the world’s most famous art instructor. But a battle for his business empire cast a shadow over his happy trees.,Bob Ross brought joy to millions as the world’s most famous art instructor. But a battle for his business empire cast a shadow over his happy trees. Documentaries,0
s995,Movie,This Lady Called Life,Kayode Kasum,"Bisola Aiyeola, Efa Iwara, Molawa Onajobi, Tina Mba, Wale Ojo, Jemima Osunde, Lota Chukwu, Samuel Asa'ah, Michael Ejoor, Uche Elumelu",Nigeria,"April 23, 2021",2020,TV-14,120 min,"Dramas, International Movies, Romantic Movies","Abandoned by her family, young single mother Aiye struggles to survive but stays focused on her dream of becoming an elite chef.","Abandoned by her family, young single mother Aiye struggles to survive but stays focused on her dream of becoming an elite chef. Dramas, International Movies, Romantic Movies",0
s3122,TV Show,Don't F**k with Cats: Hunting an Internet Killer,Mark Lewis,,"United Kingdom, United States","December 18, 2019",2019,TV-MA,1 Season,"Crime TV Shows, Docuseries",A twisted criminal's gruesome videos drive a group of amateur online sleuths to launch a risky manhunt that pulls them into a dark underworld.,"A twisted criminal's gruesome videos drive a group of amateur online sleuths to launch a risky manhunt that pulls them into a dark underworld. Crime TV Shows, Docuseries",3
